employee_id,project_id,work_date,start_time,end_time,break_duration,hours_worked,overtime,absent,shift_type,remarks
1760,112,2024-10-13,06:13:00,17:51:00,,11.23,3.17,True,,Education under century give entire property.
3032,383,2024-05-14,,20:50:00,36.0,0.0,2.07,True,day,Challenge film pressure turn maybe white whose ok executive.
2846,352,2024-11-08,,,52.0,9.02,0.55,False,day,Image month bill enough his manager region yourself foot.
1249,433,2024-06-26,,,,0.0,2.12,False,,Matter such do different way kind.
2577,18,2024-03-05,07:51:00,,,0.0,1.52,False,,Stay herself crime public above family.
1014,217,2024-08-03,09:32:00,18:12:00,,0.0,1.23,False,morning,Practice idea general offer whom none.
3185,220,2024-03-24,,,59.0,0.0,3.58,False,morning,Voice exactly word interest section away.
2932,96,2024-07-07,08:21:00,,39.0,9.93,0.0,True,,Old best guy tend subject space table fine.
2152,331,2024-07-19,,,,0.0,1.43,False,day,Leg executive actually child car we.
2011,156,2024-03-27,,16:45:00,54.0,9.18,0.0,False,,Culture sort role president carry return deep parent order family.
2248,122,2024-07-15,08:55:00,,,11.03,0.0,True,,Not truth four house push.
3935,262,2024-08-26,09:40:00,,50.0,0.0,0.0,False,morning,Free local local coach prevent price sing follow statement.
3858,495,2024-07-22,10:48:00,,,0.0,0.0,False,,Hotel yard what southern meet when particular close while include.
2831,51,2024-09-11,10:13:00,,,11.95,0.0,False,,Industry finish magazine successful skin reveal local organization former institution.
2662,96,2024-05-03,10:20:00,16:56:00,43.0,8.57,2.55,True,,Important sing us quite early.
3651,379,2024-09-26,,,30.0,9.97,1.3,False,,Likely glass herself keep left mission.
1896,312,2024-02-27,08:45:00,17:50:00,48.0,9.3,3.62,False,morning,Check sound home explain paper.
2799,162,2024-07-30,,,48.0,0.0,0.0,True,,Involve little half into north minute difference.
3536,119,2024-09-08,06:02:00,18:51:00,53.0,11.42,0.0,True,,Religious while itself job how worry.
1608,292,2024-09-01,,,34.0,11.57,1.5,False,,Wonder game tend time Republican benefit never send capital of.
3661,231,2024-10-17,09:36:00,17:38:00,60.0,11.75,0.0,False,morning,Really establish response play serve parent level open machine discover after.
2974,419,2024-04-04,,,,0.0,0.0,True,,Reality idea mouth official system.
3522,480,2024-09-13,09:47:00,17:49:00,46.0,0.0,0.0,False,,Attack education company this support I common back share personal.
2797,88,2024-08-04,10:17:00,15:39:00,58.0,0.0,0.73,False,morning,Follow speak along mother stuff institution bar collection system.
2789,158,2024-08-02,,,,0.0,0.0,True,,It especially full scientist serious main case quality likely our.
2418,337,2024-03-13,,17:55:00,,8.83,1.0,True,,Believe here less figure capital really cut.
1930,231,2024-03-19,,18:59:00,50.0,0.0,2.93,False,day,Stop father old experience deep remain technology democratic season offer.
2064,135,2024-10-09,06:20:00,,,9.28,3.25,True,morning,Receive billion they court real.
1337,393,2024-10-14,,16:02:00,44.0,0.0,1.9,True,,Piece great foot great wall almost value together however behavior.
1990,465,2024-07-12,10:15:00,19:15:00,,0.0,3.77,False,,Away while although very reflect owner accept phone.
2375,464,2024-06-08,10:54:00,,,8.77,0.0,False,morning,Allow discussion music project executive today whole now analysis.
3271,225,2024-05-22,09:00:00,17:16:00,,0.0,0.0,False,morning,Win base want after style.
1534,258,2024-07-24,,,41.0,0.0,3.97,False,,Challenge civil according value positive style.
1682,65,2024-01-02,08:50:00,17:47:00,,8.27,0.0,True,,Man himself resource wear TV Congress ball.
1024,270,2024-09-06,,,42.0,11.02,0.0,False,,Much pick mind left opportunity move Democrat.
2902,34,2024-08-28,07:53:00,,,11.82,0.0,False,morning,Throughout here little really half five arm assume responsibility might.
1838,51,2024-05-21,,,54.0,9.2,2.7,False,,Remain want big data get indicate detail.
2801,375,2024-09-28,,17:01:00,36.0,10.93,0.87,False,,Keep today you within growth.
1103,357,2024-03-18,,16:00:00,,9.68,0.83,True,,No establish learn brother two network idea member government information truth.
3995,76,2024-01-12,09:16:00,,,9.23,3.53,True,day,Market officer town television owner.
1954,236,2024-03-02,09:07:00,,,10.63,0.0,True,morning,Trade record short she truth purpose audience upon born threat.
3551,491,2024-02-04,,,,0.0,3.63,True,morning,Pass police bill read factor partner.
2031,128,2024-06-20,,21:45:00,31.0,8.67,0.0,False,,Collection need agree reduce present.
3552,478,2024-02-21,09:42:00,17:43:00,59.0,10.18,0.0,False,,Risk suffer behavior chair use particular against soon change level.
3135,317,2024-01-02,,17:37:00,37.0,0.0,0.0,False,,Most choose relationship fish add view including everyone.
1179,350,2024-09-30,06:52:00,19:45:00,52.0,9.18,0.0,True,morning,Attack contain number crime civil.
2518,142,2024-09-15,,18:42:00,,10.1,0.0,False,morning,Collection eat other model buy rather I.
2499,411,2024-06-28,,19:37:00,,10.25,2.82,False,,Want see history well.
2835,109,2024-05-29,08:42:00,22:01:00,,0.0,3.82,True,,Artist new tend worry if particular recently million.
3585,374,2024-04-18,,,,0.0,0.0,True,,Begin ahead practice eye bit mind minute according.
2180,441,2024-06-22,,,,0.0,0.47,False,morning,Receive action activity sell most task something particular receive situation.
2705,462,2024-07-08,,21:35:00,,8.6,1.38,False,,Political same military rate first.
3941,402,2024-07-17,06:37:00,,52.0,9.77,2.8,False,morning,Magazine billion chance girl resource contain design.
1388,225,2024-07-17,07:31:00,17:13:00,,8.48,0.55,False,,Growth them west thus describe if.
3453,425,2024-05-01,,,,11.07,0.0,True,,Serious job and on majority.
2935,135,2024-08-26,,17:21:00,33.0,10.55,0.0,True,,See baby owner student record.
3444,477,2024-04-26,10:16:00,,,10.87,0.0,True,morning,Politics far main loss first method this.
1351,226,2024-04-04,,,35.0,10.98,0.48,False,morning,Raise system within high middle industry heavy mouth ten garden.
1876,67,2024-04-28,07:46:00,16:46:00,,0.0,3.02,True,,Energy board simply manage middle provide.
2704,191,2024-08-02,08:14:00,,57.0,9.9,0.0,False,morning,This cost safe before my author view how well thought.
3875,431,2024-06-05,,18:32:00,,0.0,3.93,False,morning,So score specific much those parent charge onto prove.
3617,46,2024-06-30,,,55.0,0.0,0.0,False,,West research room air series hour person middle.
1074,167,2024-08-27,09:16:00,,56.0,0.0,0.05,False,,Wind leg authority stuff beat home look citizen position instead program.
1084,202,2024-03-03,,19:40:00,57.0,10.63,0.0,False,morning,Increase it man perform pass prevent.
1625,178,2024-02-16,09:50:00,,,0.0,0.0,False,morning,Cover everyone woman role site organization mission its debate.
3909,408,2024-04-13,09:17:00,,59.0,8.97,0.0,False,,Argue return lot indicate likely scientist.
3888,408,2024-11-06,,18:09:00,,8.55,2.18,False,,Stage check common recent cut learn find indicate imagine.
2347,21,2024-07-04,,21:31:00,,9.45,1.8,False,,Sit she nothing yet shake meeting mouth there.
3024,375,2024-07-08,06:39:00,17:32:00,,9.35,2.5,False,day,Fire wife should I leader charge local your require moment.
2983,189,2024-07-05,,18:43:00,,10.8,2.4,False,,Fill raise financial argue later kitchen.
1121,208,2024-04-29,06:01:00,15:31:00,40.0,10.68,0.0,False,,Drop may plant development message I analysis present.
3758,356,2024-11-04,,,40.0,0.0,0.2,True,,Whether act box purpose reduce time herself cut concern.
3527,451,2024-10-22,,18:57:00,47.0,0.0,0.0,True,,Myself physical upon sound education.
2924,345,2024-08-05,09:24:00,,,0.0,1.12,True,morning,Admit film prepare suggest bed surface.
1642,315,2024-09-22,,,,0.0,1.9,True,morning,Off seem call cause need adult election suddenly.
2641,19,2024-03-17,,,,9.92,3.17,False,morning,Discover air write explain significant section partner appear.
1948,116,2024-01-16,08:49:00,,38.0,0.0,3.75,True,,Common should politics center city on seven.
3805,309,2024-02-07,06:53:00,,58.0,11.13,0.0,True,day,Address western any book among stuff let name.
3020,140,2024-02-04,,18:37:00,,0.0,0.0,True,day,Night time race car network call listen president show.
1187,15,2024-08-05,,,39.0,0.0,0.0,False,,Issue hotel everything quality marriage run couple beautiful.
2714,69,2024-10-08,09:26:00,,59.0,0.0,0.0,True,,Safe so whose win deep detail station draw dinner government.
1948,388,2024-07-20,10:13:00,19:00:00,41.0,0.0,0.0,True,,Life front debate first under visit get any most final.
2987,71,2024-01-26,08:14:00,,,11.08,0.88,False,,Office while away this science.
3478,45,2024-10-10,06:48:00,15:22:00,,8.62,0.0,True,,Reach tax though sound opportunity paper.
1511,4,2024-03-23,08:09:00,21:27:00,48.0,0.0,1.33,True,day,Religious option meet media half because single heavy top pick.
2287,49,2024-05-17,,19:17:00,,0.0,2.13,True,morning,Money service green too organization power discuss husband.
3537,329,2024-02-28,10:21:00,19:08:00,39.0,8.88,1.98,True,,Goal officer section increase its note follow region.
3700,87,2024-09-19,09:22:00,19:38:00,,8.3,1.13,True,morning,Sit ten federal interview become spend money where finish.
3440,462,2024-06-08,,,,11.07,0.0,False,day,Western billion capital movement huge.
2299,23,2024-03-27,,20:08:00,,8.17,0.6,True,day,Ok wide so sound mother us apply rather thought.
1999,358,2024-06-08,10:00:00,17:01:00,,8.83,0.0,False,morning,Those establish kitchen itself four.
2832,325,2024-06-19,,15:22:00,,8.58,3.85,False,day,Born try friend performance benefit yes.
2812,75,2024-10-22,,19:56:00,59.0,0.0,0.0,True,,Student join industry thousand high.
2690,117,2024-09-13,,19:05:00,,11.52,3.77,False,morning,Cold million national former purpose girl benefit compare.
1050,67,2024-02-03,,,,9.88,0.0,True,morning,War recent those beat onto both see growth team.
3209,474,2024-04-15,07:18:00,,,10.3,0.0,False,,Those capital maintain discussion particular involve result.
1225,29,2024-05-21,06:06:00,,51.0,8.13,0.0,False,morning,Actually past until nice there suddenly serve team structure.
2633,422,2024-06-28,09:19:00,18:49:00,56.0,8.55,0.0,True,,Environment century allow decision public.
1841,44,2024-10-01,,21:35:00,45.0,10.93,1.12,False,day,Impact big economy anyone act too school chair anything.
3294,206,2024-05-12,,16:23:00,,11.22,0.0,False,day,Data religious stuff left mean suffer Congress I first visit over.
2260,219,2024-03-17,09:30:00,,55.0,11.47,0.0,False,,Drive culture model protect author rest.
3471,305,2024-11-07,,,,8.68,2.18,True,,Actually together itself now market popular Republican pull.
1778,436,2024-01-03,,,60.0,10.8,0.53,True,,Someone analysis attack tend.
3372,280,2024-10-14,09:59:00,16:05:00,,0.0,3.2,True,morning,Figure south factor later none different news mind.
2678,157,2024-11-06,07:30:00,21:26:00,,0.0,0.0,True,day,Environment threat star herself recent.
3387,409,2024-03-04,10:17:00,20:11:00,53.0,0.0,3.92,True,,Able court try rock several quality something region bring.
1028,315,2024-01-24,,,,11.12,0.0,False,morning,Age consumer gas investment garden.
1405,100,2024-05-29,,21:49:00,40.0,0.0,0.0,False,,Expect meet soon evening popular president poor box build discuss.
3378,437,2024-08-03,09:17:00,,,10.33,0.0,False,,East executive few discuss never design.
1532,204,2024-01-23,09:51:00,,,0.0,0.0,True,day,Various maintain young race line sure study event.
2330,364,2024-07-15,,21:43:00,44.0,10.28,0.0,False,,Health while security response bit budget force music place.
2412,64,2024-04-06,08:58:00,,37.0,0.0,0.72,False,,Memory late little four officer indeed wait.
2002,74,2024-11-06,10:43:00,,,0.0,3.42,False,,Pattern subject around specific better deal soon.
2354,328,2024-04-05,10:26:00,21:41:00,,0.0,0.0,True,,Manager those plant only identify performance little age.
1748,133,2024-10-29,,18:26:00,40.0,0.0,0.0,True,day,Interview ball machine major white throughout good ready according.
3135,311,2024-10-16,,17:32:00,39.0,8.53,2.93,True,,Entire clearly actually also unit.
3141,303,2024-04-04,,,,10.43,3.0,False,day,Bed stand somebody real whom dark him of society those.
2760,482,2024-05-05,,,,10.05,3.35,False,day,Send offer most ten still here authority offer government.
3509,318,2024-10-29,09:47:00,,32.0,8.28,0.0,False,day,He soon represent quickly loss program.
1856,310,2024-10-15,06:41:00,,,8.48,3.22,True,morning,Matter pressure according seem prepare matter eat true.
2531,243,2024-06-19,07:20:00,21:24:00,,0.0,1.03,False,morning,Seek name option financial test.
3874,440,2024-01-11,,,,0.0,3.03,True,,Chance its break official month trade though.
3687,328,2024-04-10,,18:20:00,57.0,10.03,3.83,False,day,End class finish blood character measure serve seven explain experience sound.
2868,42,2024-11-03,,17:27:00,49.0,9.9,1.12,True,,Thus professor occur agency simple data blood impact drug.
2504,193,2024-06-24,06:50:00,,44.0,11.18,1.05,False,,Step leg drop start provide one animal little history land.
2679,100,2024-01-08,,,,9.4,0.0,False,day,Cell ok less natural need car part heart about.
3848,495,2024-07-15,09:59:00,15:35:00,31.0,11.78,0.18,False,morning,Specific training reflect enter city budget stage until leader law.
1446,307,2024-05-25,10:52:00,,,11.88,0.0,False,morning,Model analysis little stand name check.
1849,54,2024-08-07,10:56:00,18:05:00,55.0,10.3,0.6,False,,Often staff indicate thus single out because.
3902,64,2024-02-29,08:00:00,19:42:00,,0.0,3.93,True,morning,With pull house low above hot finish.
1138,232,2024-06-28,,,54.0,0.0,0.0,True,,Safe consider simply campaign able arm.
1789,274,2024-09-17,07:04:00,,,10.65,0.0,False,,Management former wrong this federal.
2837,240,2024-09-25,06:04:00,14:44:00,,11.57,2.03,True,,Man she finally should according nation before finish every.
3474,83,2024-11-01,08:41:00,,33.0,8.52,2.38,True,,Finally present west society agency maintain rate.
2451,432,2024-03-10,,19:53:00,,11.05,0.0,False,,Newspaper meeting pull available both cause history should want create.
1966,294,2024-11-02,,,,0.0,1.55,True,morning,Difference follow expert method season rise cultural yard listen particular.
2722,232,2024-01-02,,,46.0,0.0,0.17,True,,From physical recently involve toward among assume boy ask.
2484,446,2024-06-23,10:55:00,,46.0,9.97,0.6,False,morning,She difference total work common so apply agency.
3803,186,2024-04-07,,,37.0,9.0,2.95,False,morning,Work watch image space thousand century physical.
2644,218,2024-01-06,,20:00:00,55.0,9.42,0.08,True,,Least record teach almost never attention structure lay.
3705,121,2024-01-28,08:14:00,,,0.0,2.52,False,morning,The person keep fire send upon maybe cup herself.
2916,410,2024-09-09,,20:53:00,,9.42,3.95,False,,Form choice school miss claim art though.
1412,344,2024-02-08,10:07:00,17:06:00,30.0,0.0,0.0,True,morning,While house sea under cost lead not.
2868,18,2024-10-06,,,,0.0,0.97,False,morning,Push who above various security over hand us.
3590,373,2024-03-27,09:24:00,21:39:00,37.0,8.42,0.0,True,morning,Dark experience receive term street artist resource.
2026,40,2024-02-10,,,33.0,11.33,0.0,True,day,Speech state answer challenge city career.
3831,330,2024-01-17,,,,0.0,0.0,False,morning,Sound realize red television role with woman.
2113,66,2024-08-05,09:29:00,,,0.0,0.0,True,,Must while strategy however fill kid.
3643,178,2024-08-13,,,56.0,0.0,0.0,True,,Final occur would talk late step amount keep short.
1413,441,2024-05-30,,18:17:00,47.0,9.25,0.0,False,,Letter product where from deep receive herself.
3977,32,2024-08-02,10:51:00,18:04:00,58.0,0.0,0.0,True,day,Stand describe same north really during reason argue education.
3126,423,2024-02-05,09:49:00,,,0.0,0.0,True,,Produce environmental home over see.
2335,31,2024-02-21,06:05:00,,,0.0,0.0,False,morning,General yeah unit mouth add necessary play.
1883,410,2024-09-28,10:03:00,19:31:00,,0.0,1.67,False,,Article option left morning government mind provide identify thank war.
1854,436,2024-02-20,09:58:00,,,0.0,3.08,True,morning,Investment property happen campaign bar source computer how common.
2887,466,2024-01-26,,18:18:00,36.0,0.0,0.0,True,,Nothing finally third character its arm.
1750,250,2024-08-26,,,57.0,8.25,3.03,True,,Big build develop professional six control have realize attack fact.
3229,198,2024-04-20,10:09:00,,,0.0,1.78,True,,Daughter within tough finish these technology TV.
3066,428,2024-09-12,07:55:00,19:41:00,56.0,9.82,0.0,False,morning,Air answer everybody unit now popular ago.
1368,218,2024-02-19,08:57:00,15:49:00,,0.0,3.45,False,morning,Person Democrat unit large everything trial station difficult economy money.
3516,216,2024-06-19,,,43.0,8.82,0.0,True,morning,Wear station role age return my office book teach.
3241,100,2024-07-20,,,,0.0,0.0,True,morning,Tough only person identify center surface.
3602,466,2024-07-08,,,,8.12,1.8,False,,Discussion style any site imagine wish save activity home commercial.
2157,123,2024-08-26,09:52:00,,54.0,8.5,0.0,False,day,Nature order name share old occur lot.
2519,376,2024-10-26,,21:17:00,,0.0,2.88,False,day,Fight bag identify style here.
1753,425,2024-01-10,09:51:00,,,0.0,0.35,True,morning,Maintain leave able statement.
1103,187,2024-01-12,10:31:00,17:12:00,,0.0,0.0,True,,Do fine rest political democratic maintain surface she second subject.
2971,133,2024-06-25,,21:49:00,32.0,11.65,0.0,True,,Ok myself guess paper political center character become health soldier rate.
3475,133,2024-04-07,,,43.0,8.02,1.02,True,morning,Professor open fear seven network each improve.
2745,146,2024-04-19,09:55:00,,,10.95,0.0,False,,Increase their sell serious thousand debate cover material reveal.
2014,286,2024-09-26,,20:27:00,43.0,8.17,3.75,True,morning,Relate necessary consumer run down federal prove there magazine often.
2655,439,2024-08-28,07:39:00,20:24:00,40.0,0.0,0.0,False,day,Throughout property picture peace store set fact top trial state.
3544,489,2024-09-15,,18:44:00,,0.0,0.0,False,,Then tell check edge series receive.
3482,168,2024-07-29,06:09:00,15:58:00,45.0,9.57,0.0,False,day,Page mind whose bad future to relate.
3807,167,2024-05-06,07:33:00,19:22:00,,11.08,3.88,True,,Husband than information instead vote.
3916,480,2024-06-20,06:32:00,17:56:00,58.0,0.0,2.33,True,,Ago serve discussion stay home type different she.
3907,180,2024-07-27,10:57:00,,43.0,11.62,3.28,False,morning,Friend art mind develop identify hand under also.
3727,54,2024-06-28,08:33:00,18:20:00,47.0,0.0,0.0,True,morning,Child act candidate find might take example training kitchen send shake.
3493,422,2024-09-22,,21:44:00,,0.0,0.0,True,,Race floor evidence nation practice share.
1110,392,2024-09-07,,17:48:00,37.0,10.18,2.93,False,,Clear agent draw pass place push issue.
3099,160,2024-03-20,,16:37:00,44.0,0.0,0.0,False,morning,Sometimes successful dog too same very against including off discover forget.
1296,389,2024-01-19,,,,0.0,2.55,False,morning,Cause country nor grow front.
3063,236,2024-09-25,10:02:00,17:20:00,,9.92,3.23,False,,Since nor agreement thank quite return race often sense.
3745,11,2024-04-07,06:16:00,,,0.0,3.23,False,,Current executive feeling along nor serious.
1270,341,2024-01-19,,17:56:00,,11.82,2.1,True,,Require technology discuss stop try agree.
2670,207,2024-01-22,,,37.0,0.0,2.65,True,morning,Baby believe too city network.
2499,259,2024-04-01,,,34.0,11.1,2.83,True,,Exactly stock trip bad than option traditional.
2367,312,2024-05-23,09:12:00,,37.0,0.0,0.0,False,,Once full against bad late increase current.
2232,42,2024-09-11,,,36.0,0.0,2.37,False,,Outside read right I we.
3007,137,2024-05-21,07:56:00,,,0.0,0.25,True,,Event general born traditional opportunity rule.
3878,21,2024-10-07,10:26:00,14:56:00,31.0,8.53,0.0,True,morning,Great newspaper everything deep stand blue instead financial.
1040,122,2024-02-14,08:17:00,18:35:00,,8.07,0.0,False,,War realize system form environmental remain former weight.
2845,467,2024-07-24,10:44:00,,,0.0,0.42,True,morning,Result them organization smile usually cover against account.
1660,181,2024-05-11,,,,0.0,2.07,True,morning,Soon strong politics feel station century positive choice whatever score.
2431,256,2024-02-05,,14:54:00,45.0,10.38,0.0,False,,Provide site pull reality garden guy billion bar.
1790,33,2024-09-15,10:58:00,18:06:00,52.0,0.0,0.0,False,morning,Rest return bring peace they political may area.
3895,368,2024-05-13,10:12:00,18:46:00,,9.63,0.47,True,,Right want main society stand send assume.
1476,245,2024-05-18,10:13:00,19:50:00,37.0,8.98,3.17,True,,Large site item well matter indeed participant idea.
2392,281,2024-02-28,06:38:00,,,11.53,0.0,True,,Perhaps various effect sister wrong leave above job.
3163,273,2024-06-04,,18:53:00,,10.37,0.0,False,,Oil we much check culture player answer town better both.
3606,284,2024-08-26,10:27:00,,31.0,9.05,0.0,False,,Hotel form wall left build front finally Mrs join.
1177,172,2024-06-28,,17:34:00,51.0,0.0,0.0,False,,Since what occur significant eye start forward hit necessary theory.
1896,354,2024-10-07,,22:12:00,56.0,0.0,1.82,True,day,Whatever rich economy light hope fear meet item whatever discuss.
2636,289,2024-10-08,,,,0.0,0.87,True,,Throughout test so begin energy night back agreement.
2605,111,2024-09-11,,18:54:00,,9.17,1.15,False,,Alone when Mrs important know.
2409,74,2024-02-23,09:29:00,18:26:00,,0.0,0.0,True,day,Society owner reach coach traditional.
2888,260,2024-08-27,06:47:00,17:43:00,,0.0,0.0,True,,Represent go section far today training.
2976,204,2024-07-18,,19:39:00,,0.0,0.0,False,morning,Head black offer clear beautiful then those person art maintain lead.
2484,67,2024-09-25,,17:33:00,58.0,9.93,0.0,True,,Apply throw art kid community ten budget short such structure.
2272,324,2024-04-03,,18:13:00,,0.0,0.0,True,morning,Local beat know author movie decision.
3372,472,2024-04-13,,,,10.93,3.12,True,day,Sit expect item know have simple stand billion.
1312,55,2024-09-01,,,46.0,0.0,0.0,True,,Throw claim research red scene food begin air.
2287,190,2024-07-28,09:54:00,20:29:00,,0.0,1.87,False,,Manager structure strong support color treat half.
2300,462,2024-08-12,06:53:00,21:49:00,,0.0,0.0,False,,Good parent word director method end office kid.
1218,79,2024-01-28,08:42:00,,,11.6,0.0,True,morning,Well million wonder degree third.
1729,416,2024-07-05,09:26:00,16:30:00,,0.0,0.0,True,,He program case western.
2531,57,2024-06-06,,,,8.67,3.67,True,,Song indeed blood among image.
1428,439,2024-03-13,,,,8.98,0.0,False,,Camera likely writer line tax foreign call want natural teach.
2733,13,2024-11-07,,,55.0,0.0,0.08,False,morning,Message so song cup tax hair summer chair road lay.
3943,471,2024-05-03,,16:14:00,,8.5,3.97,True,morning,Notice professor sense run house.
1786,76,2024-01-12,10:03:00,,41.0,9.4,0.0,False,,Term money charge garden middle none show institution.
3692,354,2024-06-18,09:14:00,,60.0,8.8,0.0,False,,Accept summer name Democrat forward station use check little.
3135,451,2024-01-05,07:56:00,,43.0,8.83,0.0,True,morning,Health opportunity eat old voice phone realize experience certainly.
1659,123,2024-02-03,,19:25:00,,0.0,0.0,False,morning,Media simply paper information scene wear couple save.
1164,26,2024-03-14,10:13:00,16:27:00,,0.0,3.38,True,,Wear material build reason might hotel listen bed red.
1569,366,2024-10-17,,,,9.75,0.0,True,day,Yes nearly upon even go expert sing together.
1711,412,2024-07-20,,18:51:00,57.0,10.9,0.13,True,,Body assume commercial exactly recently station explain.
2562,466,2024-06-24,07:52:00,,,0.0,1.45,False,morning,Care though her newspaper whose.
3266,122,2024-08-28,07:23:00,,,0.0,0.0,False,,Listen woman view paper while under.
3833,53,2024-04-17,06:01:00,,,10.62,1.6,False,,Low range federal assume leave school maybe wife.
1346,7,2024-09-19,,,30.0,0.0,0.0,True,morning,Full class education operation through site account though.
2468,25,2024-03-17,,,41.0,8.93,0.0,False,morning,Book education sport evening ready feeling.
2486,405,2024-03-19,,17:19:00,32.0,11.6,0.8,True,,Increase help different put movie bar yard alone medical.
1385,274,2024-03-18,09:48:00,,,9.42,0.0,False,,Thought reflect eat nature and lose guess current head word.
1391,142,2024-07-24,06:24:00,16:35:00,,0.0,3.55,True,,Common realize start poor.
3398,327,2024-05-28,,20:18:00,46.0,0.0,0.0,False,,Suddenly one cause room computer hospital land general interview.
2700,79,2024-03-11,07:40:00,,,0.0,0.0,True,morning,Window need black maintain however student operation catch series from.
1524,340,2024-03-16,,,31.0,11.55,0.0,False,,Growth discuss bit wide method organization.
1006,183,2024-09-23,09:34:00,,,0.0,1.43,False,,Able officer ask age policy.
3029,356,2024-05-25,07:30:00,16:52:00,,0.0,1.83,True,,Nearly magazine bit common sport door expect challenge organization everyone fish.
1440,454,2024-10-29,,15:49:00,,0.0,0.0,False,,Author game show environmental possible interesting her.
2332,31,2024-06-23,,18:14:00,,0.0,3.4,False,day,Hit have west action great practice very oil message world.
2797,171,2024-10-18,06:22:00,18:20:00,41.0,0.0,2.97,True,day,Product bit both available half Democrat tonight fast listen so.
1774,409,2024-02-17,09:21:00,17:44:00,,11.82,0.0,False,,Never organization similar realize world talk course win age.
2564,309,2024-01-26,09:16:00,,43.0,11.02,0.0,False,morning,Can for various white specific crime result which site investment company.
1305,491,2024-01-17,08:11:00,18:55:00,,0.0,3.85,True,,Remember different rule firm treatment hope value indeed few.
3706,161,2024-11-07,,,,8.37,0.0,True,day,Half song bank six pull.
2096,315,2024-05-17,08:52:00,,,0.0,2.87,True,morning,Air whatever from return attack loss.
2495,348,2024-09-19,,20:52:00,53.0,0.0,0.77,False,day,Cell continue miss truth where.
1167,378,2024-08-31,07:13:00,,,10.42,0.0,True,,Particularly large most thing prevent usually evidence culture onto try.
1048,32,2024-08-18,,21:14:00,33.0,8.5,0.0,True,morning,Back mind arm stock sort travel.
