employee_id,project_id,work_date,start_time,end_time,break_duration,hours_worked,overtime,absent,shift_type,remarks
2497,325,2024-01-13,07:08:00,19:22:00,,0.0,1.37,False,,Worker hold beyond very but career fact no.
2848,389,2024-04-10,,20:11:00,,8.52,0.0,False,day,System everybody provide my statement once growth nation wrong page.
1150,312,2024-06-19,07:56:00,21:11:00,34.0,10.82,0.0,True,,Another of college good mean ball.
2653,403,2024-01-11,,,57.0,0.0,2.67,False,,Evening win region address school up.
1554,487,2024-03-05,,,50.0,9.42,3.05,False,day,Machine since safe feel beyond speak.
2673,124,2024-09-29,08:08:00,,50.0,0.0,3.98,False,,Lot rather beat staff similar laugh together three kitchen activity design.
2036,337,2024-04-22,,,36.0,8.02,0.0,True,,Spring property city agent even even occur.
1184,436,2024-01-20,,17:00:00,,0.0,0.68,False,morning,Rock specific important simple public yet.
2566,119,2024-09-18,,17:31:00,60.0,0.0,0.63,True,,Particular traditional big need present style develop teach general.
3617,173,2024-10-26,10:18:00,17:41:00,34.0,0.0,0.0,False,,Stage right forward prove much song face nor.
3692,416,2024-09-12,,,,0.0,0.0,False,,Yes technology bag air people prevent place above arm.
3296,224,2024-08-06,08:06:00,,,0.0,0.0,True,morning,Surface food knowledge evening operation move key including concern.
3894,114,2024-03-19,,,,11.7,2.02,True,,Structure pay dog evening commercial camera spring leg.
2344,278,2024-03-07,,,55.0,11.37,0.0,False,morning,Born modern produce despite control.
2370,439,2024-06-17,06:03:00,,42.0,0.0,3.93,False,,Our to rise whatever tree soon man.
1254,48,2024-02-05,,,,0.0,0.3,True,,Music crime history right next.
1237,175,2024-09-25,07:07:00,16:37:00,52.0,0.0,0.43,True,,Themselves three owner pattern task threat film close fast security.
2085,274,2024-04-08,07:06:00,,55.0,0.0,2.82,True,,Child follow final Mrs occur.
1190,216,2024-06-18,07:51:00,,,8.75,0.0,True,morning,Page sea other under can over discuss maybe offer community build.
1172,261,2024-10-07,07:26:00,19:10:00,,0.0,3.6,True,morning,Report oil throughout want mention tough morning team success charge.
2361,343,2024-10-20,07:33:00,15:59:00,,0.0,1.75,False,,Three cup just commercial instead career.
1996,7,2024-01-06,,16:15:00,32.0,0.0,3.63,False,,Several create system property despite.
2247,424,2024-10-14,06:10:00,,,10.25,0.0,False,,Whom again really central letter.
2540,20,2024-04-07,,,,9.5,3.02,False,,Establish own care relate official against interesting station explain traditional.
2096,142,2024-01-02,08:15:00,17:51:00,,0.0,1.9,True,morning,Movie our face able should happen.
1073,144,2024-04-29,,,,0.0,0.0,True,morning,Nothing light serious term treat walk.
2060,295,2024-03-03,,15:38:00,46.0,0.0,2.88,True,morning,Lead happen model energy deal.
3291,124,2024-05-23,08:05:00,14:52:00,,8.98,0.0,False,morning,Easy sound turn director capital.
3354,168,2024-07-29,10:43:00,20:30:00,53.0,0.0,0.0,True,,Nothing sea produce consider choose.
2714,193,2024-10-05,,,35.0,9.78,3.73,False,day,Shoulder themselves site relate fly house picture role during.
1296,440,2024-06-16,09:01:00,,,8.08,0.0,False,day,Position if right theory place today skill how while.
1718,287,2024-09-05,10:46:00,,,0.0,0.0,True,morning,Major movie bank scientist perhaps relate threat.
3639,496,2024-06-17,,,37.0,11.2,0.0,False,day,Heavy report hold live choice.
3001,445,2024-06-17,08:35:00,18:05:00,53.0,10.65,3.43,False,morning,Discussion research hot nature pretty.
2954,64,2024-01-06,07:57:00,,54.0,0.0,0.0,False,day,However course size player interest artist.
1107,399,2024-03-06,,18:04:00,57.0,8.52,1.75,True,,West surface guy exactly whose season decision direction protect building.
3874,263,2024-01-16,07:18:00,,,0.0,2.03,False,day,Wait local follow well somebody character.
1077,150,2024-03-01,,,49.0,8.42,0.0,False,,Religious able offer area nation.
3839,167,2024-02-28,,15:46:00,,0.0,2.8,False,morning,Head break no task stock old place my while ten.
3593,121,2024-08-09,,,,0.0,0.03,True,,Week imagine hair couple turn animal huge.
1894,333,2024-08-04,,18:55:00,,0.0,0.6,False,morning,Necessary student record number thought baby.
2925,258,2024-09-06,07:19:00,17:45:00,47.0,9.62,0.0,False,,Economic tax begin beautiful real ever those thousand world head.
1937,40,2024-09-13,06:31:00,17:32:00,,10.8,0.0,True,,Evening mother value claim name middle thing same discuss.
1766,85,2024-08-03,06:12:00,,,10.13,0.0,False,,Matter discussion thank professional strategy respond upon.
3324,95,2024-06-04,09:44:00,16:23:00,38.0,10.85,0.0,True,,Tough ball make possible officer everyone.
3199,191,2024-06-30,06:25:00,,41.0,0.0,2.13,False,,Late throughout blue either side him from.
2743,55,2024-02-07,07:12:00,,45.0,0.0,0.0,True,,Live mind standard able.
2800,34,2024-09-12,10:19:00,,,0.0,0.0,False,day,Available away bill cover white expect never far.
3490,262,2024-05-16,,,37.0,9.05,0.0,False,,Book trip different animal single.
1452,405,2024-10-02,,21:21:00,51.0,0.0,0.0,False,morning,Kitchen person appear option apply recently.
3364,498,2024-05-31,,16:11:00,,9.18,3.18,False,,These nothing near size director able follow.
1127,208,2024-02-02,10:36:00,17:12:00,,0.0,1.55,False,day,Usually way radio lose.
1688,310,2024-03-07,09:02:00,19:29:00,,11.02,0.0,True,,Across almost year center peace sport music.
2919,340,2024-04-03,08:07:00,20:05:00,37.0,10.53,0.0,True,,Every road against cell sing clear responsibility town.
3793,457,2024-07-25,07:05:00,22:26:00,,10.87,2.95,True,day,Consider foot item performance field seek he.
1555,438,2024-01-03,07:22:00,14:29:00,,11.4,0.75,False,,Indicate station from travel kid that week board.
2062,166,2024-10-22,06:54:00,,58.0,10.1,0.17,True,day,Wind remain out ever off every sport stage carry.
2289,261,2024-10-13,10:58:00,,,0.0,1.67,False,,Go view end medical already use purpose effort election someone.
3089,282,2024-10-02,,,,0.0,0.0,True,morning,Buy myself tend defense fire notice step society.
1706,288,2024-06-23,,16:46:00,53.0,9.33,0.0,True,,Student many still because send carry live already much never rock.
2876,46,2024-02-18,,,40.0,0.0,0.0,True,morning,Most second thousand road role herself decision ever our seek.
2268,201,2024-10-18,,,,0.0,0.0,True,morning,Produce message game unit design give light product very reach.
1476,350,2024-07-26,,16:48:00,46.0,11.43,2.82,True,morning,House color single what executive who on must affect particularly.
1844,161,2024-01-12,08:36:00,,59.0,11.38,0.28,True,,Maybe few order box shoulder son strategy light.
2855,488,2024-05-29,07:12:00,,,0.0,0.95,False,morning,Miss trip sell pull chance dark Congress book.
3828,3,2024-03-08,,18:13:00,43.0,0.0,0.0,False,,Executive account live I audience.
1611,476,2024-04-14,08:13:00,,,10.72,0.0,False,,Week offer to with them thing look fear during size.
1210,156,2024-07-08,06:58:00,18:31:00,58.0,0.0,3.65,False,morning,Note actually impact control pick.
2796,454,2024-07-01,,,,11.68,3.8,True,morning,Account able go participant fall worry method raise attention than.
3748,458,2024-10-30,,17:28:00,,0.0,0.97,False,,Son memory industry range door culture.
2562,140,2024-01-14,,,,0.0,1.78,True,,Candidate at remember ever degree one nice several late.
3078,70,2024-08-14,,19:41:00,51.0,0.0,1.32,True,day,Goal only spring use exist especially simply open give claim.
1620,400,2024-04-14,06:17:00,,47.0,0.0,0.0,True,,Near sister education window certain front oil lose.
3092,30,2024-01-19,,,,9.12,0.0,False,day,Happy become station claim between.
3884,480,2024-04-07,,,,0.0,0.0,False,morning,Or our modern area pass many turn make strong consider.
1445,421,2024-04-13,,,49.0,0.0,0.68,True,morning,Inside see some themselves mouth responsibility within over.
2800,312,2024-07-23,,19:45:00,,11.27,0.0,False,,Meeting option they table performance stay agency reality.
2150,277,2024-06-17,07:49:00,17:56:00,,0.0,1.37,True,,Page sport choose different something finish truth them of data.
2378,408,2024-04-05,,22:36:00,,11.85,0.0,False,,Create fear stand group.
3287,20,2024-04-05,10:45:00,19:03:00,51.0,9.63,0.28,True,,Want method pressure best decide stock office personal medical.
2509,320,2024-02-21,09:39:00,,56.0,11.5,0.0,True,morning,Land happy agent little none whom particular election.
1784,202,2024-03-30,08:22:00,,43.0,0.0,0.43,False,,To learn above such word him may little throughout continue.
2315,133,2024-05-04,,,,11.05,0.0,True,day,Central attention career behind back fly guess this camera his.
3982,273,2024-03-25,08:07:00,19:33:00,33.0,0.0,0.0,False,morning,Need someone where town hotel manager production pattern product customer.
1244,23,2024-03-21,09:45:00,,38.0,8.62,3.22,True,day,Usually recently describe owner thus best account give quality this city.
2373,257,2024-06-19,,16:36:00,,0.0,0.0,False,day,Pm understand major me resource two.
3656,387,2024-02-17,06:38:00,,35.0,8.18,0.0,True,day,Wonder assume popular to.
1497,371,2024-02-13,,,37.0,9.07,0.0,False,morning,Natural go prove light skill thus so.
2306,215,2024-01-29,09:41:00,,,10.53,0.18,False,morning,Cup piece also million door sometimes whole idea.
1801,114,2024-02-15,06:30:00,19:40:00,,0.0,0.0,True,,Music part hard sing form focus election long half our.
1154,123,2024-02-18,09:22:00,,,0.0,0.0,False,day,Board game suddenly computer try.
2911,456,2024-05-17,,,,0.0,2.88,False,,Stuff PM rule others bag television purpose keep mention.
2433,53,2024-06-13,08:56:00,17:59:00,,0.0,3.1,False,,South choice space significant.
2646,242,2024-04-04,09:30:00,17:48:00,60.0,0.0,0.0,False,,Sport travel central music anything church scene action finally cut.
3254,479,2024-10-30,07:24:00,19:25:00,,9.25,3.47,False,morning,Else court home exist town growth place.
2287,82,2024-05-03,07:18:00,17:20:00,,0.0,1.82,True,,Expect PM control medical.
1772,133,2024-10-28,08:05:00,18:20:00,,9.7,1.33,True,morning,Road control help positive loss impact lead.
3182,288,2024-04-08,08:12:00,18:51:00,,0.0,0.0,True,,Dinner according edge here off include.
3883,148,2024-05-09,,17:04:00,60.0,9.75,0.0,True,day,Stage receive home management various.
2193,83,2024-04-10,06:36:00,19:03:00,,8.68,0.22,False,morning,Half color statement since both according Congress.
1563,203,2024-04-23,,,31.0,0.0,2.98,True,morning,Risk bank opportunity keep at use treatment federal though certainly.
3648,427,2024-08-23,,17:52:00,,11.47,3.68,True,,Clearly late good author standard when center.
1490,365,2024-05-12,,19:07:00,40.0,9.62,1.3,True,morning,Sense he appear news make play wait hard industry after.
2063,486,2024-05-26,,19:20:00,,9.78,3.03,True,,Former space only allow eye democratic.
3113,119,2024-05-02,,,51.0,9.83,1.75,True,day,Join PM drop letter protect paper here yet wide.
1797,36,2024-03-09,08:58:00,,,9.07,0.6,False,morning,Sense dream central act him on whom I.
1632,102,2024-05-05,,,,0.0,0.0,True,morning,Less daughter individual administration growth mother quite voice best chair century.
1501,344,2024-06-29,07:11:00,19:32:00,36.0,8.87,1.92,True,,But begin I eye success rest by successful.
1219,445,2024-08-22,,17:57:00,34.0,0.0,0.0,True,day,Life per wear story within people service might address argue.
2488,232,2024-01-04,,,,11.82,0.0,True,morning,War need site smile fight look something.
1708,276,2024-06-21,,16:03:00,54.0,9.65,2.47,True,,Special wait happy leg determine tell prepare whatever become pretty.
1603,211,2024-07-14,,17:19:00,42.0,11.17,1.43,False,day,Main control something detail hit sound civil likely.
3262,395,2024-05-12,08:03:00,16:40:00,,8.0,1.85,True,day,Maintain space and statement actually imagine.
2037,12,2024-02-20,08:01:00,,55.0,0.0,0.0,True,,Green hard area believe have culture door customer.
1415,49,2024-05-15,09:42:00,,42.0,0.0,1.53,True,day,Only security improve skin school want.
1847,155,2024-02-01,09:43:00,,,9.65,0.65,False,,Cut federal car raise analysis save position.
1426,158,2024-06-21,,14:54:00,35.0,0.0,3.33,True,,We thing read record particularly letter thing.
3055,302,2024-08-21,09:32:00,16:43:00,,8.78,0.63,True,morning,Rich improve must since expert health research benefit.
2727,231,2024-02-29,,18:25:00,31.0,8.92,0.57,False,,Walk themselves individual suddenly pressure much thus treatment pull.
1715,206,2024-01-18,06:20:00,,32.0,0.0,2.0,True,day,New side force they approach agree consider fight ask.
1322,187,2024-04-07,10:32:00,,,9.73,0.0,True,,Science plan eat activity list do.
3861,166,2024-01-10,10:02:00,,53.0,0.0,0.0,False,,Recently sport year particularly visit to nor spend hotel trial evening.
1126,153,2024-05-24,,,59.0,0.0,1.13,True,morning,Score phone skin home something exist moment.
1143,121,2024-08-08,,,49.0,0.0,2.98,True,,Best much other look amount adult war a fall.
2184,1,2024-05-08,,,,0.0,0.78,True,morning,Set until after wide alone blue school fall loss.
2213,423,2024-07-15,08:14:00,,30.0,0.0,0.0,False,,Energy process try explain which little.
1923,75,2024-04-13,,,57.0,0.0,1.62,False,,Education subject chance body attorney manager pretty goal six worker.
1036,389,2024-09-28,07:33:00,18:00:00,,0.0,0.0,True,,Skill leg these TV seven build wall hit student thousand.
3028,441,2024-03-17,09:37:00,,,0.0,0.0,False,,Against their author continue present rule method manage.
2135,267,2024-08-08,10:35:00,18:47:00,41.0,9.52,0.0,True,morning,Oil here nature pull what far tell.
1792,12,2024-01-25,06:14:00,20:00:00,,8.8,0.0,False,day,What grow management point relationship give base.
1564,134,2024-07-02,,19:42:00,55.0,0.0,0.28,True,morning,Program worry me national common interesting song cost feel.
2866,46,2024-01-31,,,60.0,11.68,1.22,True,day,Senior raise parent though.
3042,492,2024-04-16,09:26:00,16:26:00,46.0,0.0,3.22,False,morning,Note spring behavior front choose seat.
3217,174,2024-03-24,,21:11:00,47.0,9.85,0.0,True,,Dog alone either interest more rich site central so in.
3721,174,2024-07-16,06:36:00,20:17:00,47.0,8.88,0.52,False,day,Week course suffer beat task dream want.
3479,54,2024-03-15,,17:44:00,60.0,0.0,1.37,False,,Modern arrive collection several camera defense popular produce he.
2731,231,2024-03-09,,21:51:00,43.0,10.77,2.47,True,morning,Outside I along protect cup imagine.
1211,313,2024-02-18,08:53:00,,51.0,0.0,0.0,False,morning,Bring environment itself exactly radio especially.
3542,195,2024-03-27,06:36:00,17:52:00,,0.0,3.5,False,,Far defense ball officer country quality three factor area.
3005,215,2024-07-05,09:11:00,,,8.08,2.68,True,day,Rather surface imagine bar risk low safe.
1473,259,2024-03-23,,18:34:00,,10.72,2.98,False,morning,Reach player rise instead sign.
1402,253,2024-07-30,,,53.0,10.12,0.08,False,morning,Happen brother thing easy space.
3130,353,2024-06-20,08:54:00,,55.0,10.8,0.0,True,,Kid appear Mrs apply hair western.
1084,359,2024-01-22,08:25:00,17:55:00,45.0,0.0,0.75,False,,Education move type positive north per walk southern success.
3400,4,2024-08-10,,15:27:00,,0.0,0.0,False,,Listen note to my easy once cell majority pay pass.
3297,70,2024-10-11,,19:55:00,55.0,0.0,0.0,False,,Single myself road company drop.
2776,236,2024-02-14,06:47:00,19:07:00,,0.0,2.25,True,morning,Radio whose girl save past public cultural.
2431,399,2024-03-09,07:12:00,18:21:00,,8.65,0.0,False,,Peace start herself describe painting front office one.
1657,164,2024-10-13,08:22:00,16:50:00,,10.2,0.0,False,day,Side thus myself why.
3680,292,2024-03-09,06:48:00,17:10:00,,0.0,1.1,False,day,Involve sport realize community page Mrs.
2441,203,2024-05-07,,,40.0,11.38,0.0,False,,Compare treat exactly create senior news guess recently.
3047,319,2024-11-01,,18:32:00,,10.93,1.83,False,day,Evening bill letter present cultural force media point.
1996,328,2024-10-25,09:16:00,,,8.62,0.0,True,morning,Unit interesting power cup continue never him admit question off I.
3178,303,2024-02-10,,18:22:00,,11.65,0.0,False,morning,Can future one truth others outside.
1299,172,2024-08-04,10:34:00,20:42:00,,0.0,0.0,False,day,Protect discussion find close material.
2990,393,2024-11-05,,,,0.0,0.0,False,,Alone body investment simple summer church it.
1552,319,2024-01-17,06:02:00,,,0.0,1.08,True,day,Doctor organization determine president month religious age spring.
2175,358,2024-04-05,07:33:00,,,0.0,0.0,False,day,To population cause whose me economic this above.
3315,178,2024-05-20,,,36.0,8.65,0.02,True,morning,His go since travel dark dream station commercial.
1550,330,2024-05-13,06:35:00,,,9.82,1.43,True,,Group popular miss energy however fund.
1657,295,2024-08-10,08:05:00,,,8.68,0.78,False,morning,Every perhaps ever table test bar.
2699,322,2024-01-17,06:11:00,,52.0,0.0,0.0,True,,Drop decade group alone key point hospital great.
2292,270,2024-09-12,,,55.0,11.87,0.0,False,,Father author gun arm religious avoid daughter he.
1247,336,2024-08-02,,,,0.0,2.33,False,,Bill rather decide tell him where computer before gas.
3566,63,2024-06-17,,,58.0,8.83,1.22,True,,Center trouble debate college travel middle continue.
3089,467,2024-01-07,,,,0.0,0.0,False,day,Institution them dream growth story even community spend agree.
2497,393,2024-06-04,07:06:00,,45.0,8.3,3.55,True,morning,Beautiful magazine five door drug program each fine.
1002,102,2024-09-10,,,,0.0,0.35,False,morning,Key guy wait director suffer defense agree.
1294,64,2024-05-07,06:55:00,16:56:00,,8.43,0.0,False,morning,Yet as allow face low.
3585,395,2024-03-29,,,,0.0,0.0,False,morning,Town election number few program mean.
1336,112,2024-06-14,,20:17:00,43.0,8.25,0.0,False,,Into may open already nearly concern.
3139,135,2024-06-10,08:07:00,17:01:00,,9.05,0.0,True,morning,Budget street never herself feel talk high plan arrive generation.
1741,493,2024-05-16,,20:24:00,42.0,8.42,2.17,True,,Attorney good total miss court carry month.
2998,215,2024-07-05,,19:16:00,51.0,0.0,3.62,True,,Audience involve ready bar look building show degree computer clear.
3026,355,2024-09-30,,,30.0,8.78,1.13,True,,Who drop you summer.
3203,262,2024-08-04,,,,0.0,0.45,False,,Material probably involve draw black letter.
3712,304,2024-10-06,,18:25:00,,9.9,0.0,False,,Onto day road company which city.
1347,239,2024-01-10,,,,0.0,0.0,True,,Others seek lay watch save.
1784,414,2024-09-21,08:04:00,17:53:00,,0.0,0.0,True,morning,Expert section claim above PM course turn.
2818,46,2024-10-21,10:01:00,19:44:00,,0.0,0.2,False,,Child imagine manager subject task green address follow similar and.
1663,438,2024-02-03,,,,11.23,3.53,False,morning,Situation class walk collection culture beat marriage heart.
3774,433,2024-02-19,10:41:00,15:29:00,54.0,8.98,0.83,False,,Affect street least bring reflect past these page senior democratic.
3867,459,2024-04-22,08:12:00,,,0.0,0.0,False,morning,Can let student daughter serve west prove agent gas.
2178,220,2024-09-02,,14:30:00,30.0,0.0,0.0,False,morning,Think least president model box production.
3674,6,2024-04-30,06:49:00,,32.0,10.2,0.0,True,morning,Hundred after fire water create.
2688,491,2024-03-26,,14:37:00,,10.07,0.0,False,morning,Piece save thought unit similar sell eat.
1861,120,2024-11-08,,,,8.73,0.0,True,morning,Traditional any age run western candidate process.
2163,139,2024-08-15,06:10:00,19:49:00,51.0,0.0,0.0,True,morning,What bad possible song front likely stand show early week.
2889,473,2024-06-29,,15:45:00,41.0,11.32,1.35,False,,Congress citizen discover child garden TV happy among.
2723,98,2024-06-29,,19:39:00,,8.6,0.0,True,day,Take family movie apply everyone ever modern where.
1246,346,2024-02-10,,,30.0,10.82,3.2,True,morning,Others quickly as population deal former number standard.
1518,241,2024-08-10,08:48:00,18:21:00,47.0,9.08,1.73,False,,Against receive one site two as.
2210,39,2024-10-11,,,,0.0,0.0,False,day,Professor goal station study economic her plant drop region.
1473,340,2024-04-03,08:13:00,,51.0,0.0,0.0,True,,Where outside glass team many minute.
3509,434,2024-05-15,07:40:00,18:36:00,43.0,10.07,2.7,False,morning,The knowledge woman contain well behind talk ago get born from.
1199,320,2024-09-17,,19:24:00,40.0,10.4,0.0,False,morning,Wear outside act out admit look few which.
3553,209,2024-03-10,,,40.0,9.83,0.77,True,morning,Major work already many.
2739,47,2024-04-12,,,57.0,0.0,0.27,False,,Specific money leave wind name machine environment.
2795,307,2024-07-29,,19:26:00,40.0,8.03,0.0,False,,Election public article in every support.
1034,336,2024-06-03,06:05:00,,,0.0,1.2,True,morning,Seek purpose our kitchen begin majority well of local.
1578,49,2024-05-29,07:42:00,,37.0,0.0,0.0,False,day,Image will pick single do discover.
2818,354,2024-01-29,,18:04:00,,11.18,0.0,True,,Hospital everyone around standard lay subject begin meet they.
3836,50,2024-07-05,,,50.0,0.0,0.0,True,,Car industry along happen course put more serious international various up.
1058,314,2024-02-02,,,39.0,0.0,0.0,True,morning,Drive onto social painting song amount my later available mission.
3640,189,2024-03-19,,,59.0,0.0,1.32,True,morning,Hundred deal start interesting model tonight miss simply.
3754,2,2024-01-26,,,,8.87,0.0,False,day,Quite factor teacher our thing continue they light kitchen your.
2985,408,2024-03-16,10:09:00,19:11:00,48.0,10.8,0.0,True,day,Blood individual show discover different staff.
2076,183,2024-09-25,07:12:00,17:20:00,33.0,0.0,0.0,False,,Across long wear doctor while college.
2934,76,2024-02-03,,,57.0,8.67,3.48,False,morning,Up road worry teacher watch avoid newspaper when.
3068,167,2024-03-02,,,,0.0,3.73,True,morning,Every apply always position bill final would there.
1753,347,2024-03-03,06:06:00,,33.0,0.0,3.85,True,,Reason claim anyone boy bag challenge certain toward hear.
1580,262,2024-03-31,,,,0.0,0.0,True,,Dog throw well meeting factor later not role.
3078,425,2024-06-20,10:56:00,,42.0,9.32,0.0,True,,Reason culture buy water source mouth.
2748,340,2024-09-22,06:59:00,,,0.0,0.12,True,,Page data will clear administration.
3686,273,2024-09-12,,,48.0,0.0,0.0,False,,Body central fish discussion student medical common economic name draw.
1340,481,2024-09-13,09:01:00,,53.0,0.0,0.0,False,morning,Environmental want relate full kind light save politics.
1052,5,2024-08-26,,,,0.0,1.2,True,,Avoid financial word class organization of above form need teach.
3832,440,2024-02-11,,,,9.18,3.28,True,,Hear good factor fish any everybody knowledge.
1729,251,2024-04-05,06:12:00,,,11.7,1.67,True,morning,Experience inside about nearly baby call year civil something.
1214,252,2024-10-16,08:47:00,,,0.0,0.0,False,day,Information clearly second less store left create.
1666,13,2024-06-12,07:37:00,,49.0,0.0,0.0,True,day,Training memory animal yes determine all set several effort.
3934,459,2024-02-26,07:02:00,19:43:00,30.0,9.37,2.67,False,,Indicate public heart deal plant concern hair throughout.
3133,314,2024-01-12,09:33:00,,41.0,11.5,0.0,False,day,Realize practice clear morning tend get research marriage.
3236,121,2024-09-02,,17:30:00,,0.0,3.12,False,,Collection society still black determine per recognize carry.
3866,45,2024-09-30,,,,8.95,0.0,False,,Against region middle final together ten church unit story.
3221,412,2024-05-13,06:50:00,,38.0,9.93,3.13,True,morning,Himself some early month practice perform section very best rock.
2686,37,2024-03-16,,,30.0,0.0,0.0,True,morning,Big score adult put imagine eat difficult pick this along night.
3780,141,2024-06-24,07:11:00,,40.0,11.67,0.0,False,day,Education step series part stay stuff.
2993,83,2024-01-01,10:51:00,,,9.97,0.0,False,,Religious property attention structure industry couple suddenly.
2556,33,2024-03-22,08:20:00,17:14:00,,10.82,0.0,False,morning,There this American establish four change.
3011,51,2024-01-24,,20:10:00,,8.15,1.65,True,day,Event our performance rate you.
3511,60,2024-06-24,,17:31:00,,0.0,3.93,True,morning,Seven billion lawyer pressure investment left white another occur.
3194,418,2024-07-29,,,,10.52,0.0,False,,There part husband animal imagine young coach north.
3697,241,2024-06-28,09:36:00,,,9.32,3.42,False,,Final purpose offer country interview however either indicate.
1724,223,2024-01-19,09:32:00,,49.0,9.75,0.0,True,morning,Focus purpose present I green business cost.
1869,442,2024-07-17,,,,0.0,0.0,True,,Impact kid prepare prevent name.
1059,357,2024-06-03,,17:08:00,,0.0,0.0,False,,Them include present six treatment.
3579,221,2024-08-21,07:41:00,18:22:00,,10.77,0.0,True,,System position idea memory source have news.
2368,176,2024-02-09,,,,0.0,0.73,True,,Across simple well debate think determine discuss provide often.
3905,17,2024-06-06,,19:30:00,,0.0,0.0,False,,Control meet fall idea name find look employee often fill.
3013,65,2024-06-11,06:50:00,15:37:00,30.0,0.0,0.58,False,morning,Difficult whether also together new identify difference my yeah especially.
2434,111,2024-05-05,,,,9.45,0.0,True,,Fund loss talk reality should power without.
3989,420,2024-08-12,09:55:00,16:19:00,43.0,0.0,0.0,True,morning,Weight win health us special wall sport three music.
1602,436,2024-08-15,10:13:00,21:29:00,49.0,0.0,0.52,False,,Send claim condition push drop another somebody almost.
1163,223,2024-07-02,06:49:00,,49.0,9.13,3.97,False,,Available director baby apply exactly certainly happy exactly.
3799,10,2024-09-25,,,,0.0,2.57,False,,Edge interesting partner industry need.
1780,345,2024-04-08,,18:36:00,35.0,9.03,1.43,True,,Card full visit spend hot say son science story.
1077,435,2024-06-15,06:36:00,18:02:00,45.0,8.73,2.75,True,morning,Day daughter article lay direction.
1621,179,2024-05-12,06:06:00,17:04:00,35.0,0.0,0.0,False,morning,When friend though American page tough.
1734,409,2024-09-03,06:20:00,,,11.98,0.0,False,,People either hot just recent would cause sure level.
3899,456,2024-05-14,10:28:00,17:20:00,50.0,0.0,0.0,False,day,Bar you son prove image growth.
3395,149,2024-04-03,07:42:00,,,9.42,0.0,False,,Field space gas police onto.
