employee_id,project_id,work_date,start_time,end_time,break_duration,hours_worked,overtime,absent,shift_type,remarks
2220,353,2024-07-23,,16:53:00,48.0,11.37,1.52,True,day,Watch option Mrs develop green city.
1323,320,2024-02-11,06:17:00,,,9.82,0.0,False,,Well land than away home improve.
3115,445,2024-10-02,08:38:00,,54.0,11.18,0.0,True,morning,Media focus summer behind my I analysis.
2910,421,2024-05-27,,,,10.38,0.0,False,morning,Past agree agent nothing full read science book phone sea activity.
1362,41,2024-07-15,10:22:00,18:47:00,32.0,9.32,0.0,False,,Executive action method something material author particular modern game.
3184,221,2024-07-12,,19:46:00,,9.1,1.87,True,day,Next magazine plan girl option item manager bar section number.
2263,48,2024-04-12,,,44.0,0.0,2.4,False,day,Responsibility window nature region cell ball create bit positive.
1942,157,2024-05-05,,,,0.0,3.45,False,morning,Or deal heavy write crime grow control set.
3326,214,2024-10-13,,,,11.12,0.9,False,morning,Glass policy cause gas ball along improve.
3058,384,2024-01-02,06:31:00,,38.0,11.63,0.0,False,,Than white else hospital anything body bill wall.
3391,50,2024-05-14,09:10:00,15:26:00,52.0,0.0,0.0,False,morning,Act back yourself statement quite fear discuss.
3487,357,2024-11-01,,14:09:00,,9.2,0.87,True,,Stock our power fast her left.
1722,446,2024-09-22,,,31.0,8.57,0.0,False,,West account third itself lose Republican coach receive care.
2265,270,2024-02-27,,18:07:00,,10.43,0.08,True,day,Instead senior energy hit western region interest identify.
1765,166,2024-06-17,06:05:00,,,9.57,0.0,True,,At service apply trial could history cold mean decide.
2273,216,2024-06-24,07:26:00,,,0.0,0.78,False,,Throw research loss capital.
3797,351,2024-09-18,,20:27:00,53.0,11.97,0.0,False,day,Quite gun development tree send bar.
1875,390,2024-04-20,08:32:00,,,0.0,0.0,False,morning,Including hope partner man indicate.
3260,184,2024-08-15,10:55:00,,32.0,0.0,2.8,True,,Science woman participant class report box social in.
2093,192,2024-02-11,08:37:00,,35.0,0.0,0.0,True,day,Open sea between stay morning painting recently.
3230,118,2024-06-09,,20:31:00,,0.0,2.6,False,morning,Likely across quickly act condition house window weight.
2507,435,2024-10-11,06:48:00,,,0.0,3.88,False,,How season country agree tell but or pass.
1846,489,2024-09-20,09:51:00,18:48:00,,8.85,1.98,False,,Marriage board society kid a support spring example.
3225,403,2024-10-09,,16:21:00,,0.0,0.53,False,,Available above fish order air avoid candidate lead good.
2107,150,2024-04-01,08:02:00,20:29:00,31.0,0.0,0.0,True,morning,Their smile it every evening campaign high fish nothing trade.
2952,228,2024-05-23,,21:33:00,,8.4,1.83,False,,Out face lay degree security.
1149,99,2024-07-24,09:34:00,18:15:00,,10.13,2.95,False,morning,Exist listen cell unit century six.
3145,193,2024-02-25,10:31:00,,56.0,10.17,3.75,True,morning,Protect daughter western small staff turn.
1694,162,2024-05-26,,,40.0,0.0,3.53,True,,Her else walk take ready account just.
2706,6,2024-07-05,,,,8.02,0.18,True,day,Fact while leader serve author how plan pass cause.
3188,448,2024-07-22,07:59:00,21:14:00,44.0,8.75,0.0,True,day,Able phone data report six executive better approach.
3901,187,2024-02-12,,,33.0,9.1,0.0,False,day,Nothing fast opportunity provide do table forward.
1065,441,2024-08-21,06:22:00,18:29:00,,8.47,0.0,True,morning,Measure expect return century its rich property bar.
1562,38,2024-09-22,09:53:00,19:48:00,41.0,0.0,0.0,True,,You parent child tell between.
2707,188,2024-06-07,10:37:00,,36.0,10.13,0.0,False,,Professional for by best clearly.
1534,342,2024-03-24,,,,10.97,0.0,False,,Building born reality able lose policy region measure some.
3758,296,2024-07-19,10:24:00,20:53:00,60.0,0.0,3.27,False,,Realize establish particularly front network those power.
3048,493,2024-01-17,07:01:00,18:19:00,43.0,11.67,0.0,False,morning,Team capital campaign like wear use above consider I key.
2698,233,2024-07-06,10:28:00,18:40:00,,10.1,0.0,True,morning,Ten color light most wide girl arm computer listen also third.
2069,412,2024-05-17,,16:13:00,,9.72,0.0,True,,Paper sell forget ten live bad.
1921,236,2024-10-01,,17:41:00,59.0,0.0,0.93,False,,Research several prove week performance whose trip attention member.
3544,249,2024-09-16,10:40:00,,43.0,0.0,3.42,False,,Eight administration garden lead.
1117,135,2024-07-09,,,,10.87,0.0,False,day,Economic we down tough Mr including.
3166,386,2024-10-13,,18:10:00,,10.97,0.0,False,day,Five still gas office air want others interview conference most.
3502,323,2024-09-24,09:28:00,,36.0,11.22,1.73,True,,Set hold market condition popular body can beat occur.
2768,351,2024-10-22,10:02:00,17:35:00,,0.0,0.02,False,morning,Notice country level sign thing important rule news admit beautiful.
2054,29,2024-10-05,08:38:00,16:19:00,40.0,9.03,0.0,False,,Customer seem attack area bring world dinner situation resource else.
1084,275,2024-05-01,06:51:00,15:59:00,,0.0,2.62,False,,Choose prevent arm they need value.
2299,236,2024-08-28,07:27:00,,,11.8,0.82,True,,Choice add human myself crime.
1595,356,2024-04-08,,,44.0,9.82,3.05,True,,Subject receive guy security order heavy picture hope news.
1105,424,2024-05-11,,,,0.0,0.5,False,,Another body glass hard production hit long bank.
3798,39,2024-10-29,,15:50:00,,10.68,0.0,False,,Despite task take employee model.
1780,421,2024-09-04,,20:23:00,,8.35,0.0,False,day,Better various decision before need dinner least many.
3720,58,2024-01-25,,15:59:00,39.0,10.63,1.47,False,day,Appear eight like song else.
1035,306,2024-10-15,10:11:00,21:54:00,,10.4,3.22,False,,Know between admit avoid specific.
3316,440,2024-10-05,10:38:00,19:33:00,,10.82,3.47,False,,Hard entire ago actually wrong story effort well.
2356,160,2024-05-16,09:48:00,,,9.1,0.0,False,,Stay discover whole likely you left possible fly every month.
2316,47,2024-05-29,08:45:00,22:48:00,54.0,10.33,2.82,True,,Already whole might couple face wear.
2303,455,2024-07-07,07:35:00,,,9.9,1.27,False,day,Pattern religious front role industry through.
1899,95,2024-04-25,,20:33:00,,0.0,0.0,True,,Dream later defense hour send environmental practice worker throw attention.
1419,291,2024-01-24,06:18:00,18:08:00,,9.6,0.0,False,day,Yard later so south blood smile American east similar with.
1415,55,2024-02-16,,,36.0,0.0,2.52,False,morning,Never produce certainly within perform car give doctor.
2344,226,2024-04-27,06:13:00,17:51:00,30.0,10.85,2.02,True,,Over range upon father night real.
3779,395,2024-10-28,07:50:00,20:48:00,43.0,0.0,0.57,True,,Third stop when new.
1978,64,2024-03-14,,,,0.0,0.0,False,,Despite security box former market nature different election shake floor democratic.
3974,36,2024-04-02,08:47:00,,30.0,9.1,0.0,True,morning,Business history red particular ever organization edge.
3909,237,2024-08-06,,21:28:00,,11.07,0.0,True,morning,Him join well pattern certainly option.
2818,355,2024-02-11,08:15:00,,54.0,0.0,2.27,True,,Summer draw research wonder wrong happy manager.
2717,106,2024-04-23,09:39:00,15:36:00,,11.03,2.92,True,,Experience writer usually card Republican join out single bank.
1153,17,2024-01-14,,,58.0,0.0,0.0,False,,Plan person two sense big.
3933,318,2024-06-25,06:44:00,19:59:00,39.0,11.42,0.0,True,,Decade apply make daughter drop build trouble.
2203,483,2024-05-11,10:49:00,18:55:00,43.0,0.0,0.33,False,,But page friend himself ever wonder despite.
3071,307,2024-02-27,06:24:00,15:57:00,47.0,10.77,0.0,True,,Walk money reveal quality book hour memory mean main level.
3208,429,2024-04-16,,18:45:00,30.0,10.53,2.28,True,,Learn quickly huge project out.
3721,214,2024-03-01,,,59.0,10.67,1.1,True,morning,Computer woman camera apply fall guess employee garden.
1205,5,2024-07-08,09:21:00,,52.0,0.0,0.7,False,day,Finally computer election director student cell security sport major agree.
2285,341,2024-04-22,09:34:00,16:45:00,31.0,0.0,0.0,True,,Campaign skin enjoy treatment evening collection system budget thought generation.
1176,426,2024-08-31,,,35.0,10.82,0.0,True,,Never marriage study movement machine majority ground manager see.
3434,294,2024-07-05,,,,8.97,1.42,False,,Control citizen role report traditional news president sense in.
1373,70,2024-01-07,09:56:00,19:15:00,54.0,0.0,0.0,True,day,Wall mission nice culture the top of political.
2583,208,2024-07-21,,,,9.38,3.67,True,morning,Congress serious remain seem.
1784,116,2024-06-12,09:19:00,15:46:00,48.0,10.67,0.3,False,day,Few of employee us ever value power down up side.
2302,313,2024-10-22,07:20:00,,33.0,9.17,1.4,True,morning,Option provide position person room.
2115,102,2024-05-27,,15:41:00,,0.0,2.08,False,,Form financial parent before picture case.
2966,18,2024-06-18,,16:12:00,30.0,8.35,0.83,False,morning,Gun bring meet under sense though book central loss figure ten.
2484,493,2024-05-16,,17:00:00,41.0,10.38,0.95,True,day,Mrs prevent yard ground build series across under cover TV.
1716,63,2024-04-21,,19:55:00,52.0,10.85,2.45,True,,Without give stay me force.
3560,79,2024-06-11,07:21:00,15:33:00,,8.1,0.92,False,,Camera media manage wind head area according old.
1018,8,2024-10-04,,,42.0,9.5,2.85,True,,Author billion artist way number five family your loss whom east.
3195,253,2024-02-18,10:39:00,,,0.0,0.0,True,morning,Environmental sister likely body.
3382,327,2024-07-09,,,,8.78,0.0,False,,Drug laugh then right lose human significant more owner.
1204,418,2024-01-22,08:37:00,,,9.83,0.0,True,,Himself future require painting speak foot door.
2029,106,2024-08-12,08:55:00,,,0.0,0.05,False,morning,Time later six create we law should good trade support.
3791,471,2024-10-16,,18:18:00,49.0,0.0,0.5,False,,Red very run over development free.
2532,46,2024-08-02,10:22:00,,,0.0,0.0,True,,Sometimes morning left want pay southern mission fill.
2827,263,2024-09-02,08:30:00,19:26:00,40.0,0.0,3.6,True,,Economic others western wall carry keep business yourself manage.
3501,342,2024-06-12,10:49:00,21:14:00,,0.0,0.77,False,morning,End evening employee glass maintain practice.
2894,171,2024-06-09,08:01:00,17:33:00,,0.0,3.07,True,day,Argue bad anything bad maintain sing degree.
2254,145,2024-02-24,06:22:00,,,0.0,0.0,False,morning,Try time question price size billion.
2140,188,2024-09-06,09:54:00,18:16:00,36.0,10.68,3.45,False,,Wrong work product compare away outside heavy security.
2010,109,2024-03-12,07:06:00,,42.0,11.92,2.73,False,day,Around season war accept inside race although for ask move.
1133,139,2024-05-07,07:50:00,,,0.0,0.0,True,,Clear practice throw power area time build Congress opportunity would.
1920,26,2024-10-09,,,,0.0,0.0,False,,Main walk share treatment newspaper risk floor.
3049,346,2024-03-13,06:47:00,,37.0,0.0,1.5,False,,Today role win manager education yeah.
1758,52,2024-02-01,07:18:00,21:00:00,60.0,9.17,0.0,False,day,Least southern small authority coach chair action offer.
1015,352,2024-09-07,06:04:00,20:42:00,58.0,0.0,3.73,True,,Your husband respond model reason no.
1932,11,2024-06-19,06:38:00,19:16:00,30.0,0.0,0.0,True,morning,Friend education final worker be approach child million make light.
3797,265,2024-08-15,,21:14:00,52.0,0.0,0.0,True,morning,Dinner relationship ok charge get beat amount spend.
2319,431,2024-03-11,08:47:00,,51.0,10.72,0.0,True,day,Project here and play team language official.
1108,16,2024-06-15,,19:31:00,44.0,11.37,2.27,False,morning,Form step get one crime candidate consumer reach along economic.
1591,335,2024-07-13,,,,0.0,0.57,False,,Recognize ten billion decide top clearly.
2092,145,2024-07-16,,20:12:00,44.0,0.0,1.28,True,,Wait meeting stuff think then top maintain best stage fly.
1770,182,2024-01-17,09:42:00,,43.0,9.5,0.0,False,,Standard today Mr leave any outside.
2784,171,2024-03-01,,,44.0,0.0,0.0,False,,Act strong foreign change make positive.
2212,40,2024-03-21,,16:58:00,52.0,0.0,2.93,True,,Market himself mean practice yourself.
3518,497,2024-07-24,07:01:00,,46.0,0.0,0.0,True,morning,Accept big hour anyone because doctor risk information professional.
2141,82,2024-11-03,,16:59:00,60.0,0.0,0.0,True,morning,Poor raise candidate likely leader everything expert staff themselves.
2937,239,2024-01-26,,17:44:00,53.0,10.07,0.0,True,morning,Benefit rest southern listen still might candidate treatment plant test.
1609,275,2024-05-31,06:43:00,,,0.0,0.0,False,morning,Per marriage scene ever look because.
1904,232,2024-01-15,10:08:00,,35.0,0.0,0.0,True,day,Walk everybody region speech value.
3303,192,2024-04-16,,20:03:00,35.0,11.52,0.0,False,,Air information interesting cover as name.
2456,333,2024-07-22,09:33:00,17:17:00,54.0,0.0,0.78,True,,Act attention establish fly situation citizen deal.
3120,206,2024-07-25,10:21:00,,56.0,11.72,0.0,True,,Whole bank protect ever state officer drive.
2408,445,2024-09-06,,,,11.78,1.9,True,morning,Spend majority kitchen policy no develop office.
3119,31,2024-06-02,,,52.0,0.0,0.0,False,,Ask research art if example likely four drop where.
3079,53,2024-08-18,,,44.0,9.98,0.05,True,day,Remain common of war office.
1597,293,2024-05-28,,20:26:00,30.0,11.98,0.48,False,,Room light beautiful foot world skill today.
3482,33,2024-10-08,,18:49:00,,0.0,0.0,True,,Able national without important this talk between.
2956,10,2024-09-13,,19:01:00,40.0,0.0,3.87,True,,Produce year energy increase free though drug rich up.
2773,191,2024-02-28,,,56.0,0.0,3.87,True,,Prevent cold provide sense poor defense officer.
2369,365,2024-01-22,08:56:00,21:12:00,,0.0,0.0,False,day,Research same us why.
3244,430,2024-07-31,09:36:00,,53.0,9.23,2.35,False,morning,Among store author same evidence.
2272,388,2024-03-22,09:08:00,,36.0,0.0,0.65,False,,Which suddenly culture career now southern character her.
2140,130,2024-03-10,09:42:00,18:17:00,59.0,10.15,3.58,False,,Town view information white develop so he bag score control.
2186,403,2024-02-08,,,37.0,0.0,0.0,True,day,Blood single answer must guy book.
1789,413,2024-07-30,07:26:00,,,11.95,0.53,False,day,Feel administration what back cup right spend.
1939,60,2024-03-10,06:53:00,21:09:00,,11.62,0.0,True,day,Fly by drive audience have fast like.
1526,345,2024-07-17,09:15:00,18:45:00,32.0,8.7,3.68,False,morning,Probably stuff across choose share magazine group agency.
2249,113,2024-08-19,08:23:00,,48.0,10.7,0.37,False,morning,Network lay take seat say try establish newspaper describe sign.
2869,410,2024-10-07,07:42:00,,58.0,8.3,2.42,False,morning,Food little project for detail money form fill.
2285,132,2024-04-16,09:36:00,18:23:00,,0.0,0.97,False,,Fill that development fly debate stage myself.
2540,362,2024-07-25,,,36.0,10.67,1.27,False,day,Adult free half program safe culture.
3407,457,2024-06-13,,,43.0,0.0,2.7,True,,Only black change place quickly.
2430,109,2024-02-13,06:54:00,16:50:00,,8.78,0.0,True,morning,Low mean have people last oil cover gun.
2419,217,2024-06-18,10:09:00,,,9.87,0.0,False,,Machine nearly not goal ok.
2736,385,2024-06-15,,,,9.02,1.35,True,,House half prove everything husband scene.
1682,159,2024-02-16,10:38:00,20:37:00,49.0,9.12,3.55,True,,Picture this inside middle capital medical daughter.
3098,109,2024-07-29,,,46.0,0.0,0.0,True,,Agree forward find if find.
1432,183,2024-10-04,,,,11.17,2.78,True,day,Follow detail in north less run.
1930,195,2024-06-07,09:53:00,21:18:00,45.0,11.03,0.85,True,,Somebody understand garden federal reduce light act college lawyer.
2361,98,2024-08-16,,19:38:00,,8.12,0.0,True,,Involve Mrs begin firm audience as western keep send rise.
1108,479,2024-03-15,,19:38:00,38.0,0.0,0.0,False,day,Project above improve PM high process baby.
1970,235,2024-07-06,06:03:00,17:41:00,,0.0,0.0,True,,Though author form add truth TV training.
1734,142,2024-10-02,08:05:00,22:32:00,,8.87,0.0,True,,Down their reason blue.
1290,147,2024-04-20,08:58:00,19:17:00,,0.0,0.0,False,,Task suddenly price above red government report politics.
3996,170,2024-07-29,,17:56:00,,9.85,0.65,True,day,Attention radio carry natural move player eight.
1075,124,2024-03-21,,20:57:00,60.0,0.0,0.0,True,,It compare prove hold season if factor.
2211,253,2024-04-08,,18:26:00,33.0,0.0,0.0,True,day,While even economy serious blue actually two open upon suggest.
2158,338,2024-02-22,,18:26:00,,0.0,0.0,False,,Position budget financial unit these probably professional could.
1304,322,2024-04-17,,,40.0,10.12,1.5,True,,Him everyone arm despite stage environmental.
3749,190,2024-09-16,,18:09:00,30.0,0.0,0.0,False,morning,Cultural last system budget right carry.
3034,15,2024-09-22,,20:20:00,,9.2,0.0,False,morning,Likely cause dog my.
2509,304,2024-02-04,08:46:00,,,11.25,0.0,True,morning,Spring indicate term true do candidate.
1743,123,2024-03-10,06:58:00,17:47:00,,0.0,0.32,True,,Purpose information amount success seek president animal agree type.
1670,443,2024-07-25,09:56:00,,39.0,9.7,0.0,True,morning,Writer defense appear own realize.
1449,428,2024-05-21,09:04:00,,,10.83,0.0,False,day,Candidate law wide ask close dinner.
1953,444,2024-03-07,06:31:00,,,11.53,0.0,True,,Relate part sister decade child cover.
3567,449,2024-01-10,10:47:00,,,11.78,1.85,False,morning,Finish focus record fly herself message morning food home.
1885,336,2024-05-01,07:59:00,,53.0,9.05,0.0,False,,Think size different decade far with.
3355,312,2024-05-06,08:36:00,,38.0,0.0,2.1,True,day,Second write note increase subject meet fight.
1327,258,2024-02-29,,18:12:00,,0.0,0.0,True,,Car possible reveal create exactly perhaps suggest stuff.
2435,265,2024-03-26,,,55.0,0.0,1.62,True,,Society program country idea because whether.
3549,424,2024-02-16,06:31:00,,31.0,0.0,0.0,True,morning,Ten appear charge according democratic continue.
3323,281,2024-05-23,,19:53:00,,0.0,1.08,True,morning,Focus television although growth last indicate bank talk.
2617,212,2024-04-30,,,31.0,10.95,0.0,True,,Try city pattern nor attack red.
2157,298,2024-08-10,09:49:00,,33.0,9.05,0.0,False,day,Break student man buy perhaps ago.
3586,279,2024-01-06,10:45:00,18:06:00,,0.0,0.52,True,morning,Style region national politics sense girl plant our foreign.
3803,183,2024-06-17,07:29:00,,,9.42,2.28,False,,Show even long industry some hotel sometimes.
3523,486,2024-01-01,,,50.0,0.0,1.15,False,,Growth law community hospital end grow eat.
2169,473,2024-09-05,,,51.0,0.0,1.75,False,day,Stay mention them work raise small.
1214,472,2024-02-05,09:05:00,,,0.0,2.57,False,day,Positive American whatever expert agreement major change likely.
1207,296,2024-09-30,07:55:00,,33.0,10.55,1.22,False,,Level strategy here knowledge understand power major important various.
2158,164,2024-02-19,08:32:00,17:51:00,,11.88,0.0,True,morning,Interest voice case light check draw direction reason person.
3755,240,2024-10-19,09:19:00,20:20:00,41.0,0.0,0.0,False,,Act know including particular value age make success growth behavior.
1850,338,2024-03-20,06:36:00,22:28:00,47.0,0.0,0.0,True,,Finish if wear among its may discussion.
1875,208,2024-07-05,,,,0.0,0.0,True,morning,Adult husband usually although right.
1928,188,2024-02-17,10:45:00,17:10:00,,0.0,0.0,True,day,Society continue risk author fight south.
1933,471,2024-08-03,09:51:00,16:47:00,56.0,0.0,0.15,True,,Right sort above plan account become.
1492,389,2024-07-08,06:47:00,,,0.0,0.0,False,morning,Finish book enjoy security free cold second citizen across himself.
1756,286,2024-08-19,,15:56:00,51.0,0.0,0.0,True,,Degree ever scientist at her toward fire.
3772,34,2024-02-25,07:37:00,,52.0,11.83,0.0,True,day,Likely institution arrive degree direction state huge.
2830,275,2024-07-11,10:46:00,21:40:00,51.0,8.67,0.23,True,,Owner hair station book long edge hundred.
1404,321,2024-02-28,,,,0.0,0.0,True,,Recognize she measure southern somebody.
1098,317,2024-10-19,,,,11.65,2.87,False,,Anyone want away first if.
3569,474,2024-04-25,06:56:00,21:24:00,37.0,0.0,1.92,False,day,Man old public always be increase establish here.
3729,382,2024-01-06,06:45:00,,42.0,8.22,2.78,False,,Sound send look open fire last paper never recently.
1898,259,2024-01-28,09:24:00,21:40:00,42.0,11.98,0.0,False,,Report money firm suddenly world very.
3515,32,2024-03-16,08:51:00,,34.0,10.57,0.0,True,,Father one camera second anything which show contain charge.
3932,433,2024-04-14,09:53:00,17:42:00,,9.83,1.87,False,morning,Bill just discussion black oil attack special wonder around.
2759,180,2024-08-23,06:46:00,18:47:00,44.0,0.0,3.78,False,morning,Official turn thus both small factor reveal why.
2624,126,2024-08-05,,22:38:00,,10.4,2.98,False,morning,Start office art process responsibility relate human marriage sport.
3197,50,2024-03-06,,,48.0,9.32,2.9,True,day,Recognize three again where war sport own prove.
3345,103,2024-09-23,07:51:00,16:50:00,,9.27,0.65,False,day,Note vote consider kind today.
2578,335,2024-06-01,07:02:00,20:02:00,53.0,0.0,0.0,True,,Contain long everyone peace share.
2788,376,2024-02-19,,,56.0,0.0,3.35,True,day,Pass bring around public read something public from.
2671,371,2024-04-28,,20:37:00,,0.0,3.97,False,day,Yeah begin spring surface later education site indeed here ready fear.
2840,179,2024-02-22,06:39:00,18:32:00,,0.0,0.0,True,,Than skin receive energy debate employee activity image eat from.
3801,100,2024-08-05,09:08:00,22:16:00,,0.0,0.0,True,,Main family toward long get true man tend me.
2133,250,2024-08-28,09:16:00,,56.0,11.17,0.0,True,morning,Up later five name yourself.
3593,81,2024-10-17,09:31:00,,51.0,0.0,0.58,False,,Short significant perhaps sure win break no hold suddenly second.
3784,392,2024-02-14,10:32:00,18:46:00,52.0,11.62,0.0,False,,Rest kid senior action kind course.
1838,444,2024-04-22,07:08:00,,50.0,0.0,0.0,True,morning,Next personal far one economy key wonder week action enter.
1785,244,2024-05-09,08:02:00,19:55:00,34.0,11.45,3.63,False,morning,Minute bring music give billion later do.
2034,337,2024-08-07,06:16:00,18:03:00,45.0,0.0,0.0,False,,Range almost house party team adult raise.
2701,374,2024-08-09,07:36:00,,,0.0,0.0,False,,Everyone type laugh trip arm agent color.
1438,191,2024-01-14,06:21:00,,43.0,0.0,3.22,False,day,Service upon television provide life good two that set.
2169,98,2024-07-21,06:24:00,18:18:00,59.0,11.25,0.0,False,morning,Which political race record food.
3346,491,2024-09-24,,19:00:00,,8.77,3.95,True,,Marriage child could fund allow check.
2653,286,2024-10-29,06:37:00,,34.0,0.0,0.0,False,morning,Ok thought single eat man describe.
1617,398,2024-02-01,06:36:00,,34.0,0.0,3.9,True,,Model when activity group throw hair who analysis.
2558,217,2024-02-23,,,,0.0,0.0,False,day,Age general edge public effect conference.
1268,474,2024-02-03,09:32:00,,,9.33,3.12,True,,Exist notice production ability.
1219,301,2024-03-13,09:53:00,,52.0,9.45,0.0,False,,Hold receive full charge step wear keep else seem somebody.
1781,242,2024-05-22,08:33:00,20:07:00,,0.0,3.5,False,,Talk anyone whole top season meeting.
2311,282,2024-11-02,07:38:00,20:57:00,55.0,0.0,3.48,True,,Move avoid too indicate paper likely goal important develop.
1331,202,2024-04-08,09:29:00,21:56:00,,0.0,1.53,True,,Bring whose door hold job.
2597,482,2024-10-24,07:54:00,,,0.0,0.0,True,,Land anything enjoy north strong subject prevent sea care.
2893,155,2024-07-10,10:54:00,,,0.0,0.0,False,day,Town none thing for size.
3752,189,2024-01-05,07:39:00,,41.0,0.0,0.85,True,day,Everyone eight ability candidate assume campaign professional situation still.
2194,466,2024-03-09,06:03:00,,,9.15,0.0,True,,Strong learn impact main work professional with.
2073,206,2024-01-08,07:40:00,18:38:00,,8.28,3.5,False,day,Identify police central himself agency.
1605,42,2024-05-11,,16:16:00,59.0,0.0,0.0,True,day,Environment become always arm throw year line.
2906,107,2024-07-23,07:22:00,17:31:00,,11.87,0.0,False,morning,West campaign onto energy theory understand southern discuss hit child.
3016,480,2024-01-23,,19:49:00,57.0,10.32,0.0,False,,Adult free a rich day.
1465,201,2024-09-25,,,42.0,0.0,2.22,False,morning,Those local according people pressure hundred.
3633,195,2024-05-12,,,,8.53,1.85,True,,For above behavior easy fast door black she tonight.
2567,484,2024-08-29,07:56:00,20:39:00,35.0,8.03,3.33,False,,Leg provide participant spend fill father.
1232,205,2024-06-17,08:49:00,16:50:00,,8.17,0.0,False,,Suggest book table whose minute wall cold law gun.
3133,470,2024-06-18,10:26:00,,,9.03,2.1,True,,Edge need stage space administration art fact yet.
2234,239,2024-01-10,,,31.0,0.0,0.42,True,morning,Test film help present rich performance all per drive.
1539,436,2024-03-15,,,,0.0,0.82,False,morning,Three resource politics hot maybe establish.
1499,81,2024-07-24,,,42.0,0.0,0.0,False,day,News finish treat bring degree factor sport.
2754,162,2024-05-31,,,35.0,10.62,0.0,True,morning,Friend wife response over pass evidence production.
2041,498,2024-01-14,,,,0.0,3.42,True,morning,Each sell join soldier significant plant save she bring.
3182,446,2024-10-25,10:14:00,17:43:00,,8.42,0.6,False,day,Majority leg group according daughter window.
1254,26,2024-08-08,07:01:00,,36.0,10.15,1.58,True,,Fill anything any power big source.
1378,17,2024-06-03,,,,0.0,1.18,True,,Fear similar four success our kind tough already last such represent.
1838,200,2024-03-31,08:21:00,16:52:00,49.0,0.0,0.0,True,,Since call health dog present out.
3170,26,2024-10-17,06:25:00,,51.0,9.65,0.55,False,,Fund process win environmental throughout set evidence because measure list.
1914,450,2024-03-13,06:46:00,,30.0,0.0,0.0,True,day,Tend benefit government writer could talk improve five.
3533,353,2024-03-30,,,33.0,8.8,0.27,False,day,Area draw at number city step between conference.
2696,68,2024-06-26,07:12:00,,,10.32,2.65,False,,Lot financial great maintain.
2369,2,2024-04-22,07:34:00,,,0.0,0.0,True,morning,Woman single hospital another magazine one.
3830,348,2024-02-28,,16:04:00,30.0,0.0,0.0,True,,Really citizen particularly speech father we pass total.
