employee_id,project_id,work_date,start_time,end_time,break_duration,hours_worked,overtime,absent,shift_type,remarks
2320,428,2024-09-20,08:24:00,17:55:00,,10.68,0.0,True,day,Hotel course light state store to race than ball bag.
3752,92,2024-03-25,07:45:00,20:37:00,35.0,0.0,0.05,False,morning,Official move mouth century.
1812,349,2024-02-27,09:40:00,,,11.97,0.0,True,,Inside school speech assume me such.
3064,467,2024-11-02,,18:30:00,,0.0,0.0,True,day,Half contain above myself agreement nearly administration peace set word.
1761,407,2024-02-02,07:03:00,,55.0,11.97,1.05,False,morning,Player run relationship color include.
2254,414,2024-07-16,,16:30:00,,0.0,2.48,False,,Population director who discuss decade door right could quite mean.
3405,68,2024-01-19,09:45:00,18:55:00,,0.0,0.0,True,morning,Source set court avoid small result machine food.
3277,496,2024-02-03,,,46.0,8.97,2.43,False,,Word window operation activity wall late force fill institution no allow.
1780,453,2024-06-07,,20:36:00,50.0,0.0,0.0,True,morning,Provide six while different less explain probably style up.
2487,180,2024-04-15,,,47.0,8.93,0.0,True,,Enjoy near one military.
3610,42,2024-06-28,,17:02:00,45.0,0.0,0.0,False,morning,Within agreement local program onto although.
3318,34,2024-03-30,06:55:00,,56.0,0.0,0.0,True,,Fish simple smile public write hospital modern explain decide.
1070,72,2024-08-21,,,50.0,11.87,0.0,False,,Well call follow hot home nice.
3744,23,2024-11-01,,18:21:00,,0.0,0.0,True,,Tonight third yard across last.
2416,413,2024-01-22,09:33:00,,,8.78,0.0,True,morning,Food game effort suffer job power PM issue network bad.
2438,239,2024-06-09,,18:24:00,,0.0,0.0,True,,Investment ready property government protect my plan.
3504,459,2024-02-14,07:59:00,17:07:00,,11.92,0.0,True,,Meeting can carry wind late draw really.
3069,15,2024-10-04,07:29:00,20:20:00,,10.87,0.0,True,morning,Sense myself right budget home.
3989,344,2024-02-03,08:30:00,15:34:00,35.0,11.97,0.25,True,,Consider dinner today subject use watch phone.
2900,440,2024-05-14,07:05:00,,36.0,10.5,0.07,False,,Region goal leave nor want state week former forward whom religious.
2190,27,2024-09-03,08:11:00,18:08:00,44.0,0.0,0.0,False,,Black once identify society matter tree seek.
3726,132,2024-02-01,,17:04:00,,0.0,0.0,True,,Class world at grow will in dream available.
2515,354,2024-09-20,,,48.0,9.72,0.0,False,,Send wear administration better might choose line sign activity state.
2706,204,2024-08-27,09:39:00,,,8.82,0.0,True,day,Reason effect price born poor wind.
1513,273,2024-11-07,,,43.0,10.32,0.0,False,morning,Present agree young although action view.
2299,136,2024-05-29,10:10:00,19:34:00,,0.0,0.0,False,,Billion amount voice add reduce buy somebody mind quickly month.
2503,176,2024-09-28,,18:10:00,,10.57,0.0,True,day,Dark coach idea bank plan bar care everyone research.
1409,109,2024-01-29,08:47:00,,55.0,0.0,0.0,False,,Use similar station we TV.
1571,81,2024-06-27,06:12:00,,,0.0,0.0,False,day,Bit in model wait small finish form yes likely.
1800,216,2024-09-05,07:57:00,,,10.12,1.25,False,,Lay here buy rest wish century.
1019,275,2024-09-11,07:10:00,19:36:00,,0.0,3.4,True,day,Then when beautiful report born result act vote Mrs.
1421,148,2024-02-07,08:13:00,20:46:00,,11.97,0.0,True,,Nice hard develop house manage particularly.
2275,423,2024-07-19,06:47:00,18:37:00,,8.9,0.0,False,,Wish catch story performance address leave as son.
2169,73,2024-08-18,08:21:00,,,8.43,0.0,False,day,Step per rather officer simply we.
2200,64,2024-02-02,07:31:00,16:33:00,,11.1,3.63,True,day,Develop end six mission response pass main give spring.
1216,390,2024-11-08,06:13:00,15:18:00,,0.0,0.0,False,morning,Second much whose issue perform enjoy plant campaign staff.
1317,284,2024-06-05,,,,11.42,3.85,True,day,Goal their land quickly way west myself.
2120,33,2024-01-20,09:27:00,,,0.0,0.73,True,day,Law leg dog up important somebody couple anything feel side.
1648,232,2024-03-09,10:26:00,15:56:00,37.0,0.0,3.83,False,morning,Summer catch pattern at speech lawyer plan training long item.
2598,406,2024-06-21,08:48:00,20:22:00,,0.0,3.72,False,day,Fill camera social factor shake because cut traditional despite according.
3631,71,2024-03-29,,,,10.27,1.47,False,,Thought before cover or exist job impact ok although perform.
2697,158,2024-09-22,,,48.0,0.0,0.0,True,,These than finish stand pull science.
3625,207,2024-03-21,06:41:00,,48.0,8.17,0.98,False,morning,Capital capital accept us happy east.
3111,141,2024-10-11,08:09:00,21:03:00,,0.0,0.0,False,,Material ability develop drive factor side.
2225,159,2024-07-05,09:46:00,18:55:00,,8.78,1.75,True,,Significant best which debate vote forward although economy stuff drop.
3719,495,2024-08-07,,,,0.0,2.3,False,morning,Sister company certainly seat opportunity natural important outside great form.
3107,396,2024-04-14,07:56:00,16:11:00,,11.85,3.32,True,,Fly positive fear base career strategy then suggest home child range.
2189,273,2024-07-29,10:36:00,,,0.0,1.17,True,,Forget pattern space eye property we.
1526,278,2024-06-10,,,45.0,8.05,0.0,False,,Find event loss page effect well season follow subject upon else.
1889,276,2024-06-08,,,38.0,11.63,0.88,False,,Bad network we meeting figure.
3624,169,2024-03-21,08:36:00,17:08:00,,11.2,0.0,False,day,Lawyer bit wrong show quality full.
2885,80,2024-02-07,,,57.0,8.87,1.93,False,day,Where do level down ball wait herself official executive Mrs no.
1586,187,2024-01-22,,,,0.0,1.53,False,morning,Order generation course agency cup.
2518,310,2024-05-06,,18:03:00,,11.2,3.0,False,morning,Democratic Republican sense determine hotel society control.
3350,346,2024-10-09,10:45:00,19:04:00,40.0,10.5,2.83,False,,Challenge media relate watch support these least new stage.
3359,10,2024-02-10,07:32:00,18:36:00,,0.0,1.3,True,,Full rock if he rule want great training member certainly.
3535,286,2024-06-20,,,,8.2,0.0,False,,Let live night expect think meet game dog challenge.
2058,267,2024-07-30,07:42:00,17:15:00,57.0,0.0,3.15,False,morning,Cost analysis run American for sign fly defense.
1864,102,2024-08-12,,,,0.0,3.87,True,,Foot bar computer simple pressure organization.
1988,250,2024-07-09,09:03:00,,50.0,11.5,0.0,False,morning,Five simple movie position democratic that though smile and industry TV.
3272,235,2024-05-17,06:33:00,,,10.55,0.13,False,morning,Face order buy control girl defense although mean process.
1816,88,2024-09-01,,19:03:00,,0.0,1.52,False,,Animal street collection play small want course.
1180,43,2024-05-03,09:35:00,,,0.0,2.4,True,day,Who continue well crime central.
3466,142,2024-05-11,08:50:00,,41.0,8.73,2.75,True,morning,Region thought these song office position such important property church.
3352,388,2024-06-15,07:23:00,18:22:00,,9.85,1.02,True,,Partner writer event think north real different nation to avoid.
3033,374,2024-10-24,08:58:00,16:27:00,,9.37,1.73,False,,Business your far respond stuff close many own risk.
1154,465,2024-03-17,,19:00:00,47.0,10.35,3.65,True,morning,Pattern body operation dark kid military station.
1120,457,2024-11-07,06:13:00,18:46:00,41.0,0.0,0.0,False,,College center TV our life quickly miss develop.
1543,478,2024-01-02,,16:52:00,39.0,0.0,3.08,False,,Edge of child beautiful decide.
3044,347,2024-06-03,09:27:00,16:41:00,43.0,11.65,3.72,True,,Indeed another simple design this many executive nothing.
3910,152,2024-06-16,,,53.0,0.0,0.0,False,morning,Fund event who notice sort what manager ask station station.
3510,245,2024-08-09,,18:21:00,,0.0,2.3,False,,Trial organization job money same power.
3474,305,2024-05-21,10:47:00,20:57:00,,8.73,1.37,False,day,Agent position key try best.
3349,483,2024-03-28,,16:22:00,58.0,0.0,0.0,False,day,Customer have serious financial partner garden despite trial soon.
1679,153,2024-07-31,,,,0.0,0.77,True,,Majority add play most moment someone anything base.
3196,150,2024-08-15,07:53:00,19:44:00,39.0,0.0,0.0,True,morning,Central worry window audience computer.
1965,305,2024-09-10,07:20:00,19:57:00,,9.95,0.0,True,day,Table just for debate herself left use recent analysis audience Republican.
1957,111,2024-05-14,,17:05:00,56.0,10.07,3.97,False,,Analysis technology couple song case enjoy.
3288,100,2024-09-19,,,,0.0,0.0,True,,Available yet force young ability plant card big that.
1213,428,2024-02-29,09:51:00,15:30:00,,9.78,0.0,False,morning,Manage according low nor general point herself again.
3312,107,2024-04-05,,20:11:00,38.0,10.97,2.03,False,,History lose good two suddenly.
2835,437,2024-01-24,08:54:00,17:56:00,,10.87,2.87,False,,Management everything evening cell TV forward such third yard force.
2542,293,2024-10-24,08:31:00,,48.0,10.32,0.03,False,,Pressure reflect door garden sound body everyone computer with those.
1365,291,2024-05-04,09:08:00,21:54:00,40.0,9.98,0.0,False,,Pass there reduce young moment of provide art everything.
1971,373,2024-02-20,07:28:00,,32.0,0.0,2.9,True,,Door somebody speak never whether enter about weight direction space.
3492,113,2024-09-05,,16:41:00,,9.28,2.08,True,day,Worry government six specific blue major set.
1782,59,2024-08-07,,18:19:00,,0.0,0.0,False,,Tree together edge fine interesting here.
3830,65,2024-09-29,07:02:00,,,10.88,0.0,True,,Than least low note interview box.
1581,200,2024-07-10,06:10:00,,,9.38,2.65,False,morning,Under stand toward a there from position huge book.
3440,390,2024-06-10,,20:43:00,,9.47,2.25,True,day,Music various sing safe listen throughout born spend.
3896,9,2024-08-16,,19:45:00,38.0,0.0,0.0,True,morning,Allow across most coach oil.
1077,346,2024-05-05,,,,9.25,0.0,False,,Ago public question political interest.
1677,361,2024-07-07,08:08:00,,,0.0,2.35,False,,General account human concern leader.
2955,494,2024-09-02,08:08:00,20:41:00,,0.0,0.0,True,,Stage state sign loss once property miss so argue.
3064,133,2024-04-22,,,,11.32,0.83,True,,Society thus back money much.
1957,293,2024-02-03,,20:14:00,,11.45,0.0,True,,Usually season bit step let factor run carry thousand.
2305,2,2024-02-08,,18:51:00,47.0,9.58,0.0,True,morning,Whatever technology church fund way start according arrive.
1088,82,2024-07-01,10:02:00,,40.0,9.92,0.77,True,,Majority care garden over their walk pressure lot institution.
1647,264,2024-03-02,08:42:00,19:21:00,32.0,0.0,0.0,False,,Avoid cover public collection including gun.
2914,129,2024-01-18,06:58:00,17:15:00,53.0,8.63,0.0,True,,Collection college hot candidate especially interest task science bag.
1142,225,2024-07-06,,,,9.83,0.0,False,morning,Car game a top benefit organization establish least.
2653,99,2024-04-01,07:01:00,20:52:00,39.0,0.0,0.0,False,day,Meet pattern north customer style politics care audience.
2068,256,2024-07-19,06:00:00,17:57:00,50.0,10.4,0.0,False,,Actually meet these specific their white.
1433,387,2024-04-01,,,,0.0,3.88,True,,Economic green capital main movie enter national.
2394,373,2024-02-16,07:54:00,15:54:00,,0.0,0.0,False,,Produce produce great real.
1250,200,2024-05-10,,19:09:00,,11.25,3.95,False,,Time economy civil word describe.
1925,157,2024-02-29,09:27:00,,,0.0,0.0,True,morning,Single most skin word pay page western attorney.
2549,299,2024-07-10,09:45:00,,,11.6,3.33,False,morning,Myself whether best use seek really travel.
3752,467,2024-08-19,09:15:00,17:36:00,43.0,0.0,0.0,False,,Night total worry whether look or almost cut operation.
1637,312,2024-08-14,08:46:00,20:15:00,39.0,0.0,3.17,True,,Civil within little structure responsibility scene tell power.
2518,281,2024-09-02,09:37:00,17:12:00,33.0,9.87,0.0,False,day,Smile blood whom actually effort base evidence interview.
3606,113,2024-09-07,06:32:00,,40.0,0.0,0.0,True,,Which among special within use office detail road ten amount.
2454,237,2024-05-24,07:43:00,19:51:00,,0.0,2.03,True,,Suggest I ball response go east first network nor.
2550,313,2024-09-25,,,56.0,10.98,0.0,False,morning,Card amount write identify together.
1273,460,2024-08-27,,18:23:00,32.0,11.57,1.85,False,morning,Take hundred case recently sea paper common wife everything.
1981,477,2024-01-10,08:15:00,,,0.0,0.0,False,,Food house sense interest worry range through in lead.
1687,95,2024-04-12,06:43:00,18:34:00,33.0,10.58,0.0,False,morning,Shoulder although measure without scientist source ok.
1191,78,2024-08-03,,,,10.82,1.03,False,morning,Small opportunity Republican pattern investment instead that note manage.
2198,86,2024-08-13,,16:18:00,33.0,0.0,0.8,False,,Still loss wide despite wish image lay.
1671,465,2024-07-09,,18:08:00,,8.35,0.58,False,,Several allow board source game game may movement state live without.
1853,115,2024-03-15,,,,0.0,0.22,False,,Far else affect then executive success approach increase interview six.
1719,240,2024-05-16,08:45:00,,42.0,0.0,0.0,True,,Difference consider vote religious pressure through unit key will according.
2065,22,2024-06-25,07:58:00,20:51:00,58.0,0.0,1.7,False,,Those return see require account no team many.
2256,325,2024-06-08,,19:48:00,,0.0,0.98,True,morning,Trial explain military product.
1438,141,2024-10-07,,16:50:00,32.0,0.0,0.0,True,morning,Plan method general service tax news.
3925,94,2024-09-11,08:54:00,,,0.0,2.77,False,,Doctor there down concern soon reach similar be family.
1696,13,2024-10-22,06:36:00,21:39:00,,11.83,0.0,False,day,Road bad yourself human today.
1170,500,2024-01-23,09:05:00,,45.0,9.13,3.75,False,morning,Later station mother lawyer dark song site let beyond.
3115,145,2024-02-01,,,37.0,0.0,3.6,False,,Subject lot else environment audience air care always test.
2687,161,2024-07-15,,14:49:00,52.0,0.0,3.43,True,,Argue rule return color feel fill.
2572,216,2024-02-08,,18:40:00,42.0,9.33,2.65,True,,Break about player practice try must social up sing six real.
3724,176,2024-10-27,,17:57:00,52.0,0.0,0.0,True,,Machine rule off from board staff.
1504,107,2024-03-18,08:46:00,,36.0,0.0,3.27,True,,Which cause become deal within thought.
1048,337,2024-05-23,10:25:00,,38.0,10.28,0.0,False,,Room power matter product.
3794,347,2024-06-26,10:47:00,,,8.65,0.48,False,,Check professor black certainly data include economic everyone him design wind.
1890,207,2024-06-10,,,,0.0,0.0,True,morning,Determine organization around for building easy.
1239,41,2024-05-11,,,,11.18,2.18,False,day,Reduce move scientist heart seem.
1872,354,2024-08-07,,,49.0,9.43,0.0,False,day,Agency hear senior student wide special.
1285,272,2024-02-04,,,30.0,0.0,2.57,False,,Yard miss black from write collection.
3724,71,2024-04-30,,,,0.0,0.0,False,day,Once career have up inside message measure on friend just.
1967,81,2024-08-07,08:37:00,22:43:00,,11.7,0.0,False,morning,Ever continue property maintain people five.
3311,222,2024-01-20,07:46:00,17:33:00,58.0,8.62,0.27,False,,Peace here knowledge particular ground test admit.
1763,222,2024-06-21,,,35.0,8.57,0.0,False,day,Try behind well appear cut piece beat they himself.
1402,274,2024-09-26,08:01:00,,,11.45,0.0,False,,Mouth support whole economic bill.
1578,30,2024-05-20,06:02:00,,,0.0,0.0,True,,Measure fall couple fall make.
3449,144,2024-06-22,08:00:00,,41.0,10.92,3.63,False,morning,Production management term four community animal.
3493,149,2024-07-30,07:55:00,14:50:00,,10.05,0.0,True,,Know occur report like local family control alone call.
3430,454,2024-09-14,09:41:00,,,0.0,3.95,False,day,Light significant box dark four those role.
1691,315,2024-07-22,,17:34:00,,0.0,0.0,True,,Fight behind information perhaps rather dark probably particular.
2311,57,2024-09-20,06:04:00,17:23:00,,8.98,0.0,True,,Three north party open work around imagine let.
1467,332,2024-01-08,10:16:00,18:57:00,,11.87,0.1,True,,Human support cost happy.
1759,78,2024-01-24,10:22:00,18:39:00,41.0,0.0,0.0,True,,Crime past base picture trip deal mother despite report three.
2246,7,2024-10-24,,,,9.85,0.68,False,,Remain office red east yourself.
1222,116,2024-07-30,,,,10.28,1.3,False,,Ball of director oil relate.
2487,49,2024-05-11,09:54:00,,,8.22,0.0,False,,World such artist plant visit start focus participant among research.
2129,245,2024-01-06,,19:28:00,,0.0,0.45,True,day,Child well special both offer lead trouble network.
2487,170,2024-08-09,,21:32:00,42.0,10.97,0.0,False,morning,Be owner seek rock professor operation good drive.
2225,169,2024-09-07,10:52:00,,,11.85,0.0,False,day,I and red wonder success carry why community test environment.
3774,110,2024-03-19,10:24:00,17:23:00,54.0,0.0,0.0,True,,Provide alone popular matter PM.
3913,383,2024-08-02,08:43:00,,,0.0,0.0,True,,Future find military beat south organization.
3804,244,2024-05-12,,,,0.0,0.0,False,morning,Less seem military leg conference law report.
1299,376,2024-09-24,07:24:00,,47.0,9.08,2.73,True,,Stand away story blood common word success son.
1658,481,2024-02-09,,17:19:00,33.0,0.0,2.05,True,,Reach evidence natural southern dog what.
2073,452,2024-03-17,,17:28:00,40.0,0.0,3.32,True,morning,Physical product through hotel board security southern statement under.
3685,70,2024-07-03,09:02:00,,55.0,8.83,2.5,True,day,Kind lay decide standard quality animal computer.
1036,319,2024-04-30,09:58:00,,,0.0,2.32,False,,Nice beyond picture push hot but but.
2819,176,2024-09-22,09:49:00,16:55:00,47.0,11.63,0.0,True,morning,Career present oil American old history health.
3475,115,2024-08-24,06:57:00,,54.0,10.73,0.33,True,,Go daughter traditional wall she around animal entire yet trouble seven.
2610,59,2024-01-09,09:51:00,15:19:00,,0.0,0.0,False,day,Six race Democrat before onto.
3857,467,2024-06-09,,17:25:00,53.0,0.0,0.0,False,,Push seem environmental decade school ready.
2459,246,2024-09-13,,22:21:00,,11.37,0.0,True,,Others represent leave daughter center put most reduce.
2529,241,2024-01-10,,20:04:00,46.0,10.73,0.7,False,day,Of economic city care suddenly particular.
3129,182,2024-08-15,,,31.0,0.0,0.0,False,morning,Cold than need positive economic door measure audience.
2499,366,2024-02-25,10:27:00,19:01:00,,10.12,1.68,False,morning,House treat company second across between.
2588,343,2024-05-26,10:21:00,19:00:00,57.0,9.53,0.83,False,day,Understand result matter single today after listen than month thing.
1897,347,2024-10-02,,21:06:00,42.0,10.47,2.27,False,,Few season truth news anyone nor six share describe interesting.
2814,131,2024-08-24,09:03:00,,42.0,0.0,1.87,False,morning,Clearly trip world ready film black.
2398,305,2024-09-09,,21:35:00,,11.52,0.0,False,morning,Short huge indeed control sister new talk mean every heavy.
2053,376,2024-07-17,,,52.0,11.92,1.62,True,,Here trip than avoid walk.
1851,199,2024-06-01,06:55:00,,51.0,0.0,0.0,True,morning,Nice most commercial recognize agency.
2792,373,2024-01-11,,,,0.0,1.42,True,day,Dark various safe vote party court evidence agency.
2505,204,2024-06-17,10:53:00,18:36:00,,11.35,2.52,False,,Draw thing key attention specific ability life result kitchen statement decision.
1870,89,2024-06-19,,,,8.17,0.0,True,day,Wonder laugh little population boy.
3697,105,2024-01-30,,,,0.0,0.0,True,,Prepare subject color begin study road.
2001,242,2024-05-29,,17:35:00,56.0,8.83,3.78,False,,Available myself mean maybe up.
2395,72,2024-02-22,,,51.0,10.15,1.05,False,,Fish expert rest serve.
2088,423,2024-10-13,07:37:00,,49.0,11.1,0.0,True,day,Book military around reason ok agree civil bill.
3028,199,2024-02-22,07:22:00,15:23:00,37.0,0.0,0.0,True,,With almost practice religious part way.
1444,286,2024-09-25,,20:48:00,,0.0,2.87,False,morning,Economy movement method section across.
3781,63,2024-09-25,,,35.0,10.43,0.0,True,,Position wait financial candidate bank quality become build Democrat.
1621,375,2024-06-11,10:48:00,17:06:00,49.0,0.0,2.12,True,morning,Rich area each wall him task exactly produce traditional.
3851,237,2024-07-08,,19:18:00,38.0,9.45,0.0,False,morning,Argue operation so happen media evidence close sit.
3669,469,2024-11-08,10:14:00,,,8.8,0.0,False,,Open various have able grow factor.
1222,93,2024-09-15,,16:11:00,,10.73,0.0,True,morning,Either two beat care such tax.
2342,487,2024-08-29,,,,0.0,0.0,False,,Everyone something school positive cause natural.
1196,351,2024-05-23,,19:29:00,,0.0,2.88,False,,Audience no black week brother information least level and.
3978,159,2024-05-08,07:21:00,,,0.0,2.27,True,day,Fund management head without treatment agree model.
2507,57,2024-06-30,,,,8.93,0.12,False,,Hard fast key really high.
2219,403,2024-02-20,07:14:00,16:40:00,,0.0,2.93,False,day,Care whole force individual a old peace movie process mind.
2868,62,2024-10-19,,21:47:00,,0.0,0.0,False,,Appear military trouble nice sing benefit where anyone.
3568,396,2024-10-20,,,,8.97,0.0,False,morning,Site become performance compare art prepare ground.
2860,308,2024-02-05,09:57:00,,,0.0,3.95,False,morning,Forget during yeah ok government song simple.
3196,134,2024-04-26,,15:07:00,,0.0,0.0,True,,Hand stand growth born despite.
1264,272,2024-01-21,10:42:00,21:20:00,,0.0,0.0,False,,Up American success but local.
2452,281,2024-01-06,08:36:00,,,11.67,0.98,False,,I such product successful really identify need drug.
1729,449,2024-02-24,08:39:00,19:09:00,34.0,8.32,0.0,False,,Reality available camera three fight.
2685,70,2024-07-28,10:16:00,,54.0,0.0,1.82,False,day,Skill play fly answer thousand.
3449,420,2024-10-06,07:15:00,,,8.98,3.15,True,,Listen assume town order individual south deal.
1357,314,2024-01-23,10:31:00,15:16:00,,9.42,3.35,False,morning,Rather authority bit our onto simple face.
1271,215,2024-04-22,06:11:00,16:56:00,,0.0,2.98,True,,Finish yourself page there add democratic store enjoy agency look foot.
1457,381,2024-03-31,,19:00:00,,0.0,0.0,True,,Cut lose full service scientist heart window wall evidence accept.
2537,177,2024-01-16,09:44:00,14:34:00,,10.17,0.57,False,,Raise international range many other window between institution maybe.
2335,205,2024-01-05,10:22:00,,43.0,0.0,0.0,False,,Wonder involve probably act may.
3238,394,2024-01-05,08:16:00,19:07:00,,11.27,2.58,True,day,Probably yet example writer second support.
3134,412,2024-06-19,,,,0.0,0.0,True,morning,Or truth build work strong.
2547,155,2024-05-23,06:09:00,16:37:00,,0.0,2.97,True,,Wide huge be huge author fly.
2169,187,2024-09-17,08:12:00,,47.0,0.0,3.93,True,morning,Most tonight attention let grow fast watch unit moment.
2655,400,2024-05-05,,,31.0,0.0,0.73,False,morning,Interest player cup current discover even.
3926,390,2024-06-03,10:29:00,20:08:00,40.0,0.0,0.0,False,,Tend purpose us employee direction accept get artist.
2968,369,2024-07-14,06:41:00,22:10:00,59.0,0.0,0.0,True,day,Some performance pattern very friend.
2921,242,2024-09-30,,16:48:00,31.0,10.67,0.0,True,,Own current hard political place wind new herself.
2143,162,2024-03-28,07:30:00,,,0.0,0.0,False,,Every thousand various program from trip various far trouble.
1742,270,2024-10-19,09:27:00,19:03:00,59.0,9.18,0.55,False,,American catch fear draw southern he me.
1167,307,2024-03-31,07:45:00,17:35:00,57.0,11.48,0.0,False,morning,Contain represent site institution front teach significant break.
3128,153,2024-07-18,,,,0.0,2.0,False,,Become future important fish still speak candidate.
1665,132,2024-09-21,,,,0.0,0.48,False,,Investment bill hand hope course act dinner visit.
1511,356,2024-07-14,10:44:00,,,10.57,2.37,False,,Spend former leave national positive sometimes standard station.
3740,138,2024-10-17,07:55:00,,,11.63,0.0,False,,Low then region inside think else.
2280,395,2024-08-24,,17:20:00,56.0,8.33,0.0,True,,Eye feeling group recognize we argue too side history him.
3506,476,2024-07-01,,,36.0,0.0,0.0,False,,Realize myself other name white each practice shake happen identify.
1298,387,2024-01-18,,,,0.0,0.0,True,,Interest simply both office wife.
2322,116,2024-08-03,06:13:00,,33.0,11.93,0.52,False,day,Production outside city large police cut realize kid newspaper.
2414,52,2024-01-19,08:19:00,,,9.02,0.03,True,,Little kitchen already hard near at seven fast card.
2173,84,2024-05-12,,16:41:00,33.0,11.5,0.17,False,morning,Able level cultural hold beautiful others ahead.
1290,422,2024-03-20,,17:26:00,40.0,0.0,2.63,False,,Truth enjoy price clear red American nature all source statement.
3109,117,2024-06-16,,17:30:00,,0.0,0.78,True,,Plan ahead down such never direction often hope fire community.
3452,417,2024-09-04,07:23:00,,40.0,0.0,2.12,False,,Cultural evidence share eight another.
2486,396,2024-04-29,,19:09:00,,9.1,0.0,False,morning,Couple important create standard leave ten point.
2943,21,2024-05-10,,,,9.77,0.0,False,,Talk yard better then half myself personal.
2589,12,2024-03-25,09:17:00,20:45:00,36.0,10.85,0.0,True,,Avoid amount figure difference may rate very.
1612,344,2024-08-10,,,,10.42,0.0,True,,Even create war man note participant difficult open.
3904,69,2024-03-29,,,57.0,10.05,0.15,False,morning,Meeting travel today station group call American sport.
3142,204,2024-08-28,06:52:00,19:10:00,,8.38,0.0,True,,Side forward protect yes become about issue.
2768,197,2024-04-21,,,,9.23,0.08,True,,Short early TV free show onto late like fast.
3107,226,2024-04-30,,21:13:00,52.0,0.0,1.28,True,,New seven able item themselves season mother drug.
2407,174,2024-01-07,06:32:00,21:19:00,36.0,0.0,0.0,False,morning,Character itself dream campaign value production indeed everything list.
1337,373,2024-06-17,,,46.0,0.0,0.0,False,morning,Least his exactly almost assume stop whether.
1031,162,2024-02-19,06:34:00,,,10.0,0.33,True,day,Here side wrong smile garden within investment magazine sense establish.
1776,443,2024-02-10,,,,8.37,0.0,False,morning,Yet edge shake certainly carry physical.
1933,221,2024-02-21,09:31:00,17:07:00,,8.33,1.2,True,day,Care admit style daughter happen.
2861,26,2024-07-20,07:23:00,,34.0,0.0,0.0,True,morning,Action season rich mouth green benefit.
2641,73,2024-09-28,08:44:00,,60.0,8.83,0.0,True,,Wind show citizen article able.
2966,231,2024-04-22,08:52:00,,,9.87,0.0,True,morning,Ball ask management thus painting evidence small speech change.
